P100000120209,Zhongxin Iron and Steel Group Co Ltd,新沂市华宏钢铁有限公司,China,operating,2003-10-17 00:00:00,5400.0,5400.0,,,,5846,5846,,,10800.0,Zhongxin Iron and Steel Group Co Ltd,34.368618,118.31556
P100000120346,Zhongye Dongfang Jiangsu Heavy Industry Co Ltd,中冶东方江苏重工有限公司,China,operating,2009-10-22 00:00:00,2000.0,,2000.0,,,,,,,4000.0,BERIS Jiangsu Heavy Industry Co Ltd,32.104319,119.792126
P100000120086,Zhuhai Yueyufeng Iron and Steel Co Ltd,珠海粤裕丰钢铁有限公司,China,operating,2002,3051.0,3051.0,,,,2200,2200,,,6102.0,Zhuhai Yueyufeng IRON&STEEL Co Ltd,21.96092,113.198718
P100000121079,Zibo Qilin Fushan Iron and Steel Co Ltd,淄博齐林傅山钢铁有限公司,China,retired,2003-09-02 00:00:00,700.0,700.0,,,,740,740,,,1400.0,Zibo Qilin Fushan Steel Co Ltd,36.887998,118.145416
P100000120403,Zunyi Changling Special Steel Co Ltd,遵义长岭特殊钢有限公司,China,construction,2025,825.0,,825.0,,,,,,,1650.0,Zunyi Changling Special Steel Co Ltd,27.614947,106.949752
P100000120403,Zunyi Changling Special Steel Co Ltd,遵义长岭特殊钢有限公司,China,operating pre-retirement,2004,1100.0,,1100.0,,,,,,,2200.0,Zunyi Changling Special Steel Co Ltd,27.614947,106.949752
P100000120359,Zunyi Fuxin Special Steel Equipment Manufacturing Co Ltd,遵义福鑫特殊钢装备制造有限公司,China,construction,unknown,1110.0,,1110.0,,,,,,,2220.0,Zunyi County Fuxin Iron & Steel Product Co Ltd,27.591697,106.815453
P100000120359,Zunyi Fuxin Special Steel Equipment Manufacturing Co Ltd,遵义福鑫特殊钢装备制造有限公司,China,operating pre-retirement,1993,1150.0,,1150.0,,,,,,,2300.0,Zunyi County Fuxin Iron & Steel Product Co Ltd,27.591697,106.815453
P100000120420,GFG Liberty Ostrava steel plant,,Czech Republic,construction,2025,3500.0,,3500.0,,,,,,,7000.0,Liberty Steel Group,49.792139,18.309875
P100000120420,GFG Liberty Ostrava steel plant,,Czech Republic,mothballed,1952,,,,,,2100,2100,,,0.0,Liberty Steel Group,49.792139,18.309875
P100000120420,GFG Liberty Ostrava steel plant,,Czech Republic,retired,1952,,,,,,1100,1100,,,0.0,Liberty Steel Group,49.792139,18.309875
P100000120420,GFG Liberty Ostrava steel plant,,Czech Republic,operating pre-retirement,1952,3600.0,3600.0,,,,,,,,7200.0,Liberty Steel Group,49.792139,18.309875
P100000120419,TZMS Třinecké železárny Trinec steel plant,,Czech Republic,operating,1839,1500.0,1300.0,200.0,,,1100,1100,,,3000.0,TRINECKÉ ZELEZÁRNY AS,49.689053,18.654557
P100000120419,TZMS Třinecké železárny Trinec steel plant,,Czech Republic,announced,2030,2600.0,1300.0,1300.0,,,,,,,5200.0,TRINECKÉ ZELEZÁRNY AS,49.689053,18.654557
P100000120419,TZMS Třinecké železárny Trinec steel plant,,Czech Republic,operating pre-retirement,1839,1300.0,1300.0,,,,1000,1000,,,2600.0,TRINECKÉ ZELEZÁRNY AS,49.689053,18.654557
P100001045209,Al Gioshy Steel Ain Sokhna plant,,Egypt,operating,2015,500.0,,500.0,,,,,,,1000.0,AlGioshy Steel SAE,29.6752173,32.3028163
P100000120446,Al-Ezz Dekheila Steel Alexandria plant,العز الدخيلة للصلب - الاسكندرية,Egypt,operating,1986,3200.0,,3200.0,,,2320,,2320,,6400.0,Al Ezz Dekheila Steel Company Alexandria SAE,31.123467,29.80987
P100000121213,Delta Steel Mill Al Qalyubia plant,,Egypt,operating,1947,500.0,,500.0,,,,,,,1000.0,Delta Steel Company Ltd,30.11843,31.281264
P100000120443,Egyptian American Steel Rolling Company Sadat City plant,بشاي للصلب,Egypt,operating,1998,1200.0,,1200.0,,,,,,,2400.0,Egyptian American Steel Rolling Company SAE,30.389174,30.571894
P100000120444,Egyptian Iron & Steel Company Cairo plant,شركة الحديد والصلب المصرية,Egypt,retired,1957,3200.0,3200.0,,,,1400,1400,,,6400.0,Egyptian Iron & Steel Co,29.774458,31.312013
P100000120445,Egyptian Sponge Iron and Steel Company Sadat City plant,الشركة المصرية للحديد الإسفنجي و الصلب,Egypt,operating,2008,3000.0,,3000.0,,,1800,,1800,,6000.0,Egyptian Sponge Iron & Steel Company SAE,30.393079,30.58773
P100000120450,Egyptian Steel Ain Sokhna plant,مصنع العين السخنة - الحديد المصريين,Egypt,operating,2018,600.0,,600.0,,,,,,,1200.0,Egyptian Steel Group,29.64769,32.2789
P100000120451,Egyptian Steel Beni Suef plant,مصنع بني سويف - الحديد المصريين,Egypt,operating,2016,600.0,,600.0,,,,,,,1200.0,Egyptian Steel Group,29.15243,31.24911
P100000120447,Ezz Flat Steel Ain Sokhna plant,حديد عز,Egypt,operating,1998,3900.0,,3900.0,,,1900,,1900,,7800.0,Al Ezz Flat Steel Company SAE,29.692045,32.322117
P100000120448,Ezz Steel Rebar Sadat City plant,حديد عز,Egypt,operating,1994,1000.0,,1000.0,,,,,,,2000.0,Ezz Steel Co,30.382179,30.563029
P100001044924,Hebei Xinfeng Suez Canal Economic Zone,,Egypt,announced,unknown,2000.0,,2000.0,,,,,,,4000.0,Hebei Xinfeng High-pressure Flange and Pipe Fitting Co Ltd,29.71349,32.31094
P100001044904,SMS Group DRI Plant,,Egypt,announced,unknown,,,,,,2500,,2500,,0.0,SMS Group GmbH,26.787872,30.572474
P100000121218,Suez Canal Economic Zone steel complex,,Egypt,announced,unknown,1800.0,,,,1800,,,,,1800.0,unknown,29.731257,32.299298
P100000120449,Suez Steel Solb Misr Attaka plant,SSC,Egypt,operating,2000,2100.0,,2100.0,,,2100,,2100,,4200.0,Suez Steel Company SAE,29.923176,32.466587
P100000121233,Ekos Steel Dukem plant,,Ethiopia,cancelled,2018,500.0,,500.0,,,,,,,1000.0,Ekos Steel Mill PLC,8.781155,38.932065
P100000120471,Blastr Inkoo steel plant,,Finland,announced,2026,2500.0,,2500.0,,,2000,,2000,,5000.0,Blastr Green Steel AS,60.0175,23.9126
P100000121220,GravitHy Kristinestad iron plant,,Finland,announced,unknown,,,,,,2000,,2000,,0.0,GravitHy,62.273929,21.379356
P100000120469,Outokumpu Tornio steel plant,,Finland,operating,1976,1200.0,,1200.0,,,,,,,2400.0,Outokumpu Stainless AB,65.767115,24.176472
P100000120470,Ovako Imatra steel plant,,Finland,operating,1935,575.0,,575.0,,,,,,,1150.0,Ovako AB,61.149466,28.798774
P100000120468,SSAB Raahe steel plant,,Finland,announced,unknown,2600.0,,2600.0,,,,,,,5200.0,SSAB AB,64.651111,24.418544
P100000120468,SSAB Raahe steel plant,,Finland,operating pre-retirement,1964,2600.0,2600.0,,,,2600,2600,,,5200.0,SSAB AB,64.651111,24.418544
P100000120472,ArcelorMittal Dunkerque steel plant,,France,operating,1963,6750.0,6750.0,,,,6900,6900,,,13500.0,ArcelorMittal Atlantique et Lorraine SAS,51.041274,2.292948
P100000120472,ArcelorMittal Dunkerque steel plant,,France,announced,2028,2250.0,,2250.0,,,,,,,4500.0,ArcelorMittal Atlantique et Lorraine SAS,51.041274,2.292948
P100000120472,ArcelorMittal Dunkerque steel plant,,France,cancelled,1963,2250.0,,2250.0,,,2500,,2500,,4500.0,ArcelorMittal Atlantique et Lorraine SAS,51.041274,2.292948
P100000120475,ArcelorMittal Florange steel plant,,France,retired,1906,2400.0,2400.0,,,,2848,2848,,,4800.0,ArcelorMittal Atlantique et Lorraine SAS,49.331722,6.143107
P100000120473,ArcelorMittal Méditerranée Fos sur Mer steel plant,,France,operating,1974,2550.0,2550.0,,,,,,,,5100.0,ArcelorMittal Méditerranée SAS,43.43283,4.887166
P100000120473,ArcelorMittal Méditerranée Fos sur Mer steel plant,,France,announced,2027,2000.0,,2000.0,,,,,,,4000.0,ArcelorMittal Méditerranée SAS,43.43283,4.887166
P100000120473,ArcelorMittal Méditerranée Fos sur Mer steel plant,,France,mothballed,1974,,,,,,2000,2000,,,0.0,ArcelorMittal Méditerranée SAS,43.43283,4.887166
P100000120473,ArcelorMittal Méditerranée Fos sur Mer steel plant,,France,operating pre-retirement,1974,2550.0,2550.0,,,,2000,2000,,,5100.0,ArcelorMittal Méditerranée SAS,43.43283,4.887166
P100000121234,Ascometal Hagondange steel plant,,France,operating,1912,825.0,,825.0,,,,,,,1650.0,Ascometal France Holding SAS,49.241492,6.152631
P100000120474,Celsa France Boucau steel plant,,France,operating,1965,1200.0,,1200.0,,,,,,,2400.0,Celsa France SAS,43.529693,-1.500971
P100000121172,GravitHy Fos sur Mer iron plant,,France,announced,2028,,,,,,2000,,2000,,0.0,GravitHy,43.436519,4.852576
P100000121177,Liberty Steel Dunkerque DRI plant,,France,announced,unknown,,,,,,2000,,2000,,0.0,Liberty Steel Group,50.99926,2.168571
P100000120476,LME Trith-Saint-Léger steel plant,,France,operating,1875,820.0,,820.0,,,,,,,1640.0,Lamines Marchands Europeens SA,50.3292,3.490913
P100000121235,Marcegaglia Fos Sur Mer steel plant,,France,announced,unknown,300.0,,300.0,,,,,,,600.0,Marcegaglia Holding SpA,43.445004,4.846805
P100000121235,Marcegaglia Fos Sur Mer steel plant,,France,mothballed,1973,900.0,,900.0,,,,,,,1800.0,Marcegaglia Holding SpA,43.445004,4.846805
P100000120481,Riva Alpa Gargenville steel plant,,France,operating,1974,700.0,,700.0,,,,,,,1400.0,ALPA - Aciéries et Laminoirs de Paris SAS,48.983515,1.76245
P100000120480,Riva Iton Seine Bonnieres Sur Seine steel plant,,France,operating,1916,550.0,,550.0,,,,,,,1100.0,Iton Seine SAS,49.033678,1.561022
P100000120478,Riva Sam Montereau steel plant,,France,operating,1973,720.0,,720.0,,,,,,,1440.0,Sam Montereau SAS,48.387211,2.981091
P100000120479,Riva Sam Neuves-Maisons steel plant,,France,operating,1872,850.0,,850.0,,,,,,,1700.0,Societe des Aciers d'Armature pour le Beton SAS,48.611482,6.111864
P100000120477,Saarstahl Ascoval Saint-Saulve steel plant,,France,operating,1975,730.0,,730.0,,,,,,,1460.0,Saarstahl AG,50.398171,3.561712
P100000120423,AG der Dillinger Hüttenwerke Dillingen steel plant,,Germany,announced,2027,3150.0,,3150.0,,,2500,,2500,,6300.0,AG der Dillinger Hüttenwerke AG,49.353884,6.746603
P100000120423,AG der Dillinger Hüttenwerke Dillingen steel plant,,Germany,mothballed,1969,,,,,,730,730,,,0.0,AG der Dillinger Hüttenwerke AG,49.353884,6.746603
P100000120423,AG der Dillinger Hüttenwerke Dillingen steel plant,,Germany,operating pre-retirement,1969,2760.0,2760.0,,,,4782,4782,,,5520.0,AG der Dillinger Hüttenwerke AG,49.353884,6.746603
P100000120426,ArcelorMittal Bremen steel plant,,Germany,operating,1957,2000.0,2000.0,,,,2600,2600,,,4000.0,ArcelorMittal Bremen GmbH,53.133305,8.688193
P100000120426,ArcelorMittal Bremen steel plant,,Germany,cancelled,1957,1400.0,,1400.0,,,2000,,2000,,2800.0,ArcelorMittal Bremen GmbH,53.133305,8.688193
P100000120426,ArcelorMittal Bremen steel plant,,Germany,operating pre-retirement,1957,1800.0,1800.0,,,,1250,1250,,,3600.0,ArcelorMittal Bremen GmbH,53.133305,8.688193
P100000120428,ArcelorMittal Duisburg steel plant,,Germany,announced,2030,1300.0,,1300.0,,,,,,,2600.0,ArcelorMittal Duisburg GmbH,51.462987,6.744612
P100000120428,ArcelorMittal Duisburg steel plant,,Germany,operating pre-retirement,1852,1300.0,1300.0,,,,,,,,2600.0,ArcelorMittal Duisburg GmbH,51.462987,6.744612
P100000120425,ArcelorMittal Eisenhüttenstadt steel plant,,Germany,operating,1950,1200.0,1200.0,,,,,,,,2400.0,ArcelorMittal Eisenhüttenstadt GmbH,52.168649,14.623473
P100000120425,ArcelorMittal Eisenhüttenstadt steel plant,,Germany,cancelled,1950,2400.0,,2400.0,,,150,,150,,4800.0,ArcelorMittal Eisenhüttenstadt GmbH,52.168649,14.623473
P100000120425,ArcelorMittal Eisenhüttenstadt steel plant,,Germany,operating pre-retirement,1950,1200.0,1200.0,,,,1825,1825,,,2400.0,ArcelorMittal Eisenhüttenstadt GmbH,52.168649,14.623473
P100000120427,ArcelorMittal Hamburg steel plant,,Germany,operating,1969,1100.0,,1100.0,,,600,,600,,2200.0,ArcelorMittal Hamburg GmbH,53.522601,9.900749
P100000120427,ArcelorMittal Hamburg steel plant,,Germany,announced,2026,,,,,,100,,100,,0.0,ArcelorMittal Hamburg GmbH,53.522601,9.900749
P100000120435,Benteler Steel Tube Lingen plant,,Germany,operating,1974,650.0,,650.0,,,,,,,1300.0,Benteler Steel/Tube GmbH,52.467622,7.317169
P100000120434,CSN Stahlwerk Thüringen Unterwellenborn steel plant,,Germany,operating,1878,1100.0,,1100.0,,,,,,,2200.0,Stahlwerk Thueringen GmbH,50.654574,11.43745
P100000120438,Deutsche Edelstahlwerke steel plant,,Germany,operating,1927,600.0,,600.0,,,,,,,1200.0,Deutsche Edelstahlwerke GmbH,50.922844,8.024006
P100000120436,ESF Elbe Stahlwerke Feralpi Riesa plant,,Germany,operating,1992,1400.0,,1400.0,,,,,,,2800.0,ESF Elbe-Stahlwerke Feralpi GmbH,51.3128,13.280386
P100001045310,Georgsmarienhütte Osnabrück steel plant,,Germany,operating,1856,650.0,,650.0,,,,,,,1300.0,Georgsmarienhuette GmbH,52.2122334,8.0420724
P100000120422,Hüttenwerke Krupp Mannesmann (HKM) steel plant,,Germany,announced,2025,6000.0,,6000.0,,,>0,,>0,,12000.0,Hüttenwerke Krupp Mannesmann GmbH,51.371279,6.72331
P100000120422,Hüttenwerke Krupp Mannesmann (HKM) steel plant,,Germany,operating pre-retirement,1909,6300.0,6300.0,,,,5200,5200,,,12600.0,Hüttenwerke Krupp Mannesmann GmbH,51.371279,6.72331
P100000120429,Kehler Baden Steel Works,Badische Stahlwerke,Germany,operating,1955,2500.0,,2500.0,,,,,,,5000.0,Badische Stahlwerke GmbH,48.595058,7.821633
P100000120437,Lech Stahlwerke Meitingen steel plant,,Germany,operating,1970,1400.0,,1400.0,,,,,,,2800.0,Lech Stahlwerke GmbH,48.512051,10.855292
P100000120430,Riva Brandenburg Electric Steel Works,Brandenburg Elektrostahlwerke,Germany,operating,1912,1800.0,,1800.0,,,,,,,3600.0,BES Brandenburger Elektrostahlwerke GmbH,52.402617,12.496135
P100000120431,Riva Hennigsdorfer Electric Steel Works,Hennigsdorfer Elektrostahlwerke,Germany,operating,1917,1000.0,,1000.0,,,,,,,2000.0,HES Hennigsdorfer Elektrostahlwerke GmbH,52.650903,13.212683
P100000120432,Saarstahl Völklingen Steelmaking Plant,,Germany,announced,2027,1900.0,,1900.0,,,,,,,3800.0,Saarstahl AG,49.247635,6.848662
P100000120432,Saarstahl Völklingen Steelmaking Plant,,Germany,operating pre-retirement,1873,3240.0,3240.0,,,,,,,,6480.0,Saarstahl AG,49.247635,6.848662
P100000120424,Salzgitter Flachstahl steel plant,,Germany,announced,2033,,,,,,>0,,>0,,0.0,Salzgitter Flachstahl GmbH,52.161794,10.409371
P100000120424,Salzgitter Flachstahl steel plant,,Germany,construction,2026,1900.0,,1900.0,,,2100,,2100,,3800.0,Salzgitter Flachstahl GmbH,52.161794,10.409371
P100000120424,Salzgitter Flachstahl steel plant,,Germany,operating pre-retirement,2001,5200.0,5200.0,,,,4590,4590,,,10400.0,Salzgitter Flachstahl GmbH,52.161794,10.409371
P100000120433,Salzgitter Peiner Träger Peine steel plant,,Germany,operating,1858,1000.0,,1000.0,,,,,,,2000.0,Peiner Traeger GmbH,52.313935,10.258482
P100000120421,ThyssenKrupp Steel Duisburg steel plant,,Germany,announced,2026,,,,,,2500,,2500,,0.0,Thyssenkrupp Steel Europe AG,51.491649,6.733051
P100000120421,ThyssenKrupp Steel Duisburg steel plant,,Germany,operating pre-retirement,1891,11000.0,11000.0,,,,11400,11400,,,22000.0,Thyssenkrupp Steel Europe AG,51.491649,6.733051
P100000120489,Sentuo Steel Tema plant,,Ghana,operating,2015,800.0,,800.0,,,,,,,1600.0,Sentuo Steel Ltd,5.670032010618004,0.0158561829466604
P100000120491,Halyvourgiki Eleusis steel plant,,Greece,retired,1932,1200.0,400.0,800.0,,,2500,2500,,,2400.0,Halyvourgiki SA,38.043873,23.508083
P100000121196,Hellenic Halyvourgia Velestino steel plant,,Greece,operating,1963,700.0,,700.0,,,,,,,1400.0,Hellenic Halyvourgia SA,39.38588,22.80745
P100000120493,Sidenor Steel Industry Thessaloniki plant,,Greece,operating,1962,800.0,,800.0,,,,,,,1600.0,Sidenor Steel Industry SA,40.704458,22.816542
P100000120492,Sovel Almyros steel plant,,Greece,operating,2001,1350.0,,1350.0,,,,,,,2700.0,Sovel SA,39.169632,22.840216
P100000120494,AG Sidegua Masagua steel plant,Planta siderúrgica AG Sidegua Masagua,Guatemala,operating,1994,500.0,,500.0,,,,,,,1000.0,Corporación AG SA,14.232007,-90.815444
P100000121046,Shiu Wing Tuen Mun Steel plant,,Hong Kong,announced,2025,700.0,,700.0,,,,,,,1400.0,Shiu Wing Steel Ltd,22.369498,113.926095
P100000120496,Liberty Steel Dunaferr Dunaújváros steel plant,,Hungary,announced,2030,3000.0,,3000.0,,,,,,,6000.0,Liberty Steel Group,46.945694,18.93863
P100000120496,Liberty Steel Dunaferr Dunaújváros steel plant,,Hungary,retired,1954,,,,,,640,640,,,0.0,Liberty Steel Group,46.945694,18.93863
P100000120496,Liberty Steel Dunaferr Dunaújváros steel plant,,Hungary,operating pre-retirement,1954,1600.0,1600.0,,,,,,,,3200.0,Liberty Steel Group,46.945694,18.93863
P100000120496,Liberty Steel Dunaferr Dunaújváros steel plant,,Hungary,mothballed pre-retirement,1954,,,,,,660,660,,,0.0,Liberty Steel Group,46.945694,18.93863
P100001045296,Action Ispat and Power Jharsuguda steel plant,,India,operating,unknown,375.0,,,,375,220,,220,,375.0,Action Ispat and Power Pvt Ltd,21.839759,83.982227
P100001045296,Action Ispat and Power Jharsuguda steel plant,,India,announced,unknown,7125.0,,,,7125,,,,,7125.0,Action Ispat and Power Pvt Ltd,21.839759,83.982227
P100001025815,Adhunik Metaliks Kuanrmunda steel plant,,India,operating,2003-05-01 00:00:00,500.0,,500.0,,,330,180,150,,1000.0,Adhunik Metaliks Ltd,22.308371,84.763584
P100000120532,ArcelorMittal Bellary steel plant,,India,cancelled,unknown,6000.0,,,,6000,>0,,,>0,6000.0,ArcelorMittal SA,15.139498,76.918417
P100001025671,ArcelorMittal Nippon Steel Anakapalle steel plant,,India,announced,2029-01-01 00:00:00,24000.0,24000.0,,,,17800,17800,,,48000.0,ArcelorMittal Nippon Steel India Ltd,17.407103,82.723183
P100001025669,ArcelorMittal Nippon Steel Gadchiroli steel plant,,India,announced,unknown,6000.0,,6000.0,,,,,,,12000.0,ArcelorMittal Nippon Steel India Ltd,20.168486,79.987119
P100000120513,ArcelorMittal Nippon Steel Hazira Plant,,India,operating,1995,9600.0,,4600.0,,5000,11570,2040,7830,1700,14200.0,ArcelorMittal Nippon Steel India Ltd,21.112377,72.647304
P100000120513,ArcelorMittal Nippon Steel Hazira Plant,,India,announced,2028,9000.0,,,,9000,,,,,9000.0,ArcelorMittal Nippon Steel India Ltd,21.112377,72.647304
P100000120513,ArcelorMittal Nippon Steel Hazira Plant,,India,construction,2025,6000.0,6000.0,,,,8000,8000,,,12000.0,ArcelorMittal Nippon Steel India Ltd,21.112377,72.647304
P100000120573,ArcelorMittal Nippon Steel Kendrapara plant,,India,announced,2032,24000.0,24000.0,,,,14001,14001,,,48000.0,ArcelorMittal Nippon Steel India Ltd,20.71042,86.282806
P100000121178,ArcelorMittal Nippon Steel Paradip Steel Plant,,India,announced,2029,7000.0,7000.0,,,,7000,7000,,>0,14000.0,ArcelorMittal Nippon Steel India Ltd,20.284771,86.658266
P100000120568,Arjas Steel Tadipatri plant,,India,operating,2012-11-01 00:00:00,334.0,334.0,,,,324,324,,,668.0,Arjas Steel Pvt Ltd,14.873471,78.048425
P100000120568,Arjas Steel Tadipatri plant,,India,construction,2025,620.0,620.0,,,,700,700,,,1240.0,Arjas Steel Pvt Ltd,14.873471,78.048425
P100000120564,Atibir Industries Bhorandiha steel plant,,India,operating,2009,,,,,,600,600,,,0.0,Atibir Industries Co Ltd,24.145239,86.334999
P100000120564,Atibir Industries Bhorandiha steel plant,,India,announced,unknown,600.0,600.0,,,,,,,,1200.0,Atibir Industries Co Ltd,24.145239,86.334999
P100001023581,Baldota Koppal steel plant,,India,announced,2026,10500.0,3500.0,,,7000,3800,3800,,>0,14000.0,Baldota Steel and Power Ltd,15.332616,76.206778
P100000120512,BMM Ispat Danapur steel plant,,India,operating,2006,2208.0,1100.0,1000.0,,108,1640,880,760,,4308.0,BMM Ispat Ltd,15.16972,76.37971
P100001023577,Captain Steel Garbeta steel plant,,India,announced,2026,1000.0,,,,1000,>0,,,>0,1000.0,Captain Steel India Ltd,22.855859,87.345018
P100001045282,Crest Steel and Power Mangatta Steel Plant,,India,operating,unknown,130.0,,,,130,232,,232,,130.0,Crest Steel and Power Pvt Ltd,21.190313,81.19922
P100001045282,Crest Steel and Power Mangatta Steel Plant,,India,announced,unknown,1046.0,,475.0,,571,728,728,,,1521.0,Crest Steel and Power Pvt Ltd,21.190313,81.19922
P100001045282,Crest Steel and Power Mangatta Steel Plant,,India,construction,unknown,,,,,,232,,232,,0.0,Crest Steel and Power Pvt Ltd,21.190313,81.19922
P100000120534,Electrosteel Bokaro steel plant,,India,operating,2006,1500.0,1500.0,,,,1568,1568,,,3000.0,ESL Steel Ltd,23.632907,86.293671
P100000120534,Electrosteel Bokaro steel plant,,India,announced,2026,5500.0,1000.0,,,4500,1100,1100,,,6500.0,ESL Steel Ltd,23.632907,86.293671
P100000121207,Electrosteel Castings Srikalahasthi Steel Plant,,India,operating,1994,,,,,>0,575,575,,,0.0,Electrosteel Castings Ltd,13.717188,79.630588
P100000121207,Electrosteel Castings Srikalahasthi Steel Plant,,India,announced,unknown,,,,,>0,,,,,0.0,Electrosteel Castings Ltd,13.717188,79.630588
P100000121207,Electrosteel Castings Srikalahasthi Steel Plant,,India,mothballed,1994,,,,,>0,,,,,0.0,Electrosteel Castings Ltd,13.717188,79.630588
P100000121207,Electrosteel Castings Srikalahasthi Steel Plant,,India,operating pre-retirement,1994,,,,,>0,,,,,0.0,Electrosteel Castings Ltd,13.717188,79.630588
P100000121195,Evonith Metallics Wardha Steel Plant,,India,operating,1994,,,,,,1300,1300,,,0.0,Evonith Metallics Ltd,20.704605,78.620293
P100000121195,Evonith Metallics Wardha Steel Plant,,India,announced,2025,500.0,500.0,,,,,,,,1000.0,Evonith Metallics Ltd,20.704605,78.620293
P100000121236,Evonith Value Steel Wardha Steel Plant,,India,operating,1970,1080.0,,1080.0,,,,,,,2160.0,Evonith Metallics Ltd,20.696412,78.638548
P100001045317,Gallantt Ispat Gorakhpur steel plant,,India,operating,unknown,528.0,,,,528,545,,545,,528.0,Gallantt Ispat Ltd,26.757009,83.199086
P100000121216,Godawari Power and Ispat Sarora Steel Plant,,India,announced,2026,2200.0,,,,2200,2000,2000,,,2200.0,Godawari Power and Ispat Ltd,21.565032,81.739447
P100000120557,Godawari Power and Ispat Siltara steel plant,,India,operating,2001,659.0,,,,659,528,33,495,,659.0,Godawari Power and Ispat Ltd,21.376214,81.681888
P100000120552,Hospet Steels Hospet plant,,India,operating,1998,650.0,650.0,,,,700,700,,,1300.0,Hospet Steels Ltd,15.339055,76.251696
P100000120552,Hospet Steels Hospet plant,,India,announced,2025,811.0,500.0,233.0,,78,940,940,,,1544.0,Hospet Steels Ltd,15.339055,76.251696
P100000120552,Hospet Steels Hospet plant,,India,cancelled,1998,,,,,,500,,500,,0.0,Hospet Steels Ltd,15.339055,76.251696
P100000120560,Jai Balaji Durgapur Unit IV steel plant,,India,operating,2009,295.0,,,,295,200,80,120,,295.0,Jai Balaji Industries Ltd,23.483075,87.352189
P100000120560,Jai Balaji Durgapur Unit IV steel plant,,India,announced,unknown,578.0,,182.0,,396,,,,,760.0,Jai Balaji Industries Ltd,23.483075,87.352189
P100000120562,Jai Balaji Jyoti Steels Sundargarh plant,,India,operating,2003,92.0,,,,92,120,,120,,92.0,Jai Balaji Jyoti Steels Ltd,22.085338,84.86184
P100000120562,Jai Balaji Jyoti Steels Sundargarh plant,,India,announced,2030,330.0,,66.0,,264,594,,594,,396.0,Jai Balaji Jyoti Steels Ltd,22.085338,84.86184
P100001025922,Jai Balaji Rajbandh Unit III steel plant,,India,operating,unknown,,,,,,630,630,,,0.0,Jai Balaji Industries Ltd,23.487439,87.369494
P100001025922,Jai Balaji Rajbandh Unit III steel plant,,India,announced,unknown,450.0,,450.0,,,,,,,900.0,Jai Balaji Industries Ltd,23.487439,87.369494
P100000120561,Jai Balaji Steels Raghunnathpur plant,,India,cancelled,2030,6000.0,,5400.0,,600,6480,2680,3800,,11400.0,Jai Balaji Steels Purulia Ltd,23.331734,86.363224
P100000120547,Jayaswal Neco Industries Raipur steel plant,,India,operating,1996,1200.0,,1200.0,,,1270,1000,270,,2400.0,Jayaswal Neco Industries Ltd,21.354495,81.676444
P100000120547,Jayaswal Neco Industries Raipur steel plant,,India,announced,2025,1250.0,,1250.0,,,1000,1000,,,2500.0,Jayaswal Neco Industries Ltd,21.354495,81.676444
P100000120544,Jindal Stainless Hisar steel plant,,India,operating,1970,800.0,,800.0,,,,,,,1600.0,Jindal Stainless Ltd,29.127253,75.773075
P100000120543,Jindal Stainless Jajpur steel plant,,India,operating,2011,2200.0,,2200.0,,,2000,2000,,,4400.0,Jindal Stainless Ltd,20.954939,86.051986
P100000120543,Jindal Stainless Jajpur steel plant,,India,announced,2027,999.0,,647.0,,352,840,840,,,1646.0,Jindal Stainless Ltd,20.954939,86.051986
P100001044907,JSOL Angul steel plant,,India,announced,2025,12900.0,6900.0,6000.0,,,12100,9400,2700,,25800.0,Jindal Steel Odisha Ltd,20.874713,84.944082
P100001044907,JSOL Angul steel plant,,India,construction,2025,6300.0,6300.0,,,,7300,4600,2700,,12600.0,Jindal Steel Odisha Ltd,20.874713,84.944082
P100000120515,JSPL Angul steel plant,,India,operating,2013,6000.0,3500.0,2500.0,,,6050,4250,1800,,12000.0,Jindal Steel & Power Ltd,20.884896,84.991539
P100000120515,JSPL Angul steel plant,,India,announced,2030,13000.0,13000.0,,,,13000,13000,,,26000.0,Jindal Steel & Power Ltd,20.884896,84.991539
P100000120515,JSPL Angul steel plant,,India,construction,2026-09-01 00:00:00,6000.0,6000.0,,,,6000,6000,,,12000.0,Jindal Steel & Power Ltd,20.884896,84.991539
P100000121173,JSPL Asanboni Steel Plant,,India,announced,unknown,6500.0,6500.0,,,,6200,6200,,,13000.0,Jindal Steel & Power Ltd,24.131037,87.438728
P100000121034,JSPL Krishnapatnam steel plant,,India,announced,unknown,3000.0,3000.0,,,,>0,,,>0,6000.0,Jindal Steel & Power Ltd,14.254675,80.108702
P100000120542,JSPL Patratu steel plant,,India,announced,unknown,6000.0,6000.0,,,,3200,3200,,,12000.0,Jindal Steel & Power Ltd,23.632991,85.325308
P100000120516,JSPL Raigarh steel plant,,India,operating,1989,3600.0,,3600.0,,,4370,3050,1320,,7200.0,Jindal Steel & Power Ltd,21.922703,83.347178
P100000120516,JSPL Raigarh steel plant,,India,announced,2027,8100.0,8100.0,,,,11700,9000,2700,,16200.0,Jindal Steel & Power Ltd,21.922703,83.347178
P100000120521,JSW Bengal Steel Salboni plant,,India,cancelled,2036,10000.0,10000.0,,,,>0,>0,,,20000.0,JSW Bengal Steel Ltd,22.575726,87.310258
P100000120537,JSW BPSL Jharkhand steel plant,,India,cancelled,2030,3000.0,,3000.0,,,,,,,6000.0,Bhushan Power & Steel Ltd,22.665526,85.64622
P100000120510,JSW BPSL Jharsuguda steel plant,,India,operating,2005,5000.0,,3500.0,,1500,4270,2350,1920,,8500.0,JSW Steel Ltd,21.763989,84.022529
P100000120570,JSW Green Steel Salav plant,,India,operating,1993,,,,,,1000,,1000,,0.0,JSW Green Steel Ltd,18.530853,72.947091
P100000120570,JSW Green Steel Salav plant,,India,announced,unknown,10000.0,,10000.0,,,,,,,20000.0,JSW Green Steel Ltd,18.530853,72.947091
P100000120570,JSW Green Steel Salav plant,,India,cancelled,1993,3000.0,,3000.0,,,2450,,750,1700,6000.0,JSW Green Steel Ltd,18.530853,72.947091
P100001023578,JSW JFE Electrical Bellary Steel plant,,India,announced,2027,4000.0,,,,4000,,,,,4000.0,JSW JFE Electrical Steel Pvt Ltd,15.042769,76.445529
