P100000120717,Libyan Iron and Steel Misrata plant,الشركة الليبية للحديد والصلب,Libya,announced,2027,,,,,,2000,,2000,,0.0,Libyan Iron and Steel Co,32.335185,15.215053
P100001023430,Tosyali-SULB Benghazi Plant,توسيالي - صلب,Libya,announced,unknown,2700.0,,2700.0,,,5600,,5600,,5400.0,Tosyali Sulb Steel Industries Joint Company,32.12156,20.08413
P100001023430,Tosyali-SULB Benghazi Plant,توسيالي - صلب,Libya,construction,unknown,,,,,,2500,,2500,,0.0,Tosyali Sulb Steel Industries Joint Company,32.12156,20.08413
P100000120714,ArcelorMittal Differdange steel plant,,Luxembourg,operating,1896,1350.0,,1350.0,,,,,,,2700.0,ArcelorMittal SA,49.527966,5.900398
P100000120715,ArcelorMittal Esch-Belval steel plant,,Luxembourg,construction,2025,1250.0,,1250.0,,,,,,,2500.0,ArcelorMittal SA,49.504175,5.993759
P100000120715,ArcelorMittal Esch-Belval steel plant,,Luxembourg,operating pre-retirement,1911,1000.0,,1000.0,,,,,,,2000.0,ArcelorMittal SA,49.504175,5.993759
P100000120750,Alliance Steel Kuantan plant,,Malaysia,operating,2017,3500.0,3500.0,,,,3500,3500,,,7000.0,Alliance Steel (M) Sdn Bhd,4.007595,103.344458
P100000120750,Alliance Steel Kuantan plant,,Malaysia,announced,2026,6500.0,,,,6500,6500,,,6500,6500.0,Alliance Steel (M) Sdn Bhd,4.007595,103.344458
P100000120748,Ann Joo Integrated Steel Penang plant,,Malaysia,operating,2007,900.0,,900.0,,,500,500,,,1800.0,Ann Joo Integrated Steel Sdn Bhd,5.380391,100.377598
P100000120749,Ann Joo Steel Selangor plant,,Malaysia,operating,1961,820.0,,820.0,,,,,,,1640.0,Ann Joo Steel Bhd,3.042585,101.537011
P100000120747,Eastern Steel Kemaman plant,,Malaysia,operating,2015,2700.0,2700.0,,,,2400,2400,,,5400.0,Eastern Steel Sdn Bhd,4.285062,103.432551
P100000120747,Eastern Steel Kemaman plant,,Malaysia,announced,2027,3500.0,,,,3500,,,,,3500.0,Eastern Steel Sdn Bhd,4.285062,103.432551
P100000120743,Eden Flame Johor steel plant,,Malaysia,operating,1993,1050.0,,1050.0,,,,,,,2100.0,Eden Flame Sdn Bhd,1.451512,103.917306
P100000120744,Esteel Antara Labuan iron plant,,Malaysia,operating,1984,,,,,,900,,900,,0.0,Antara Steel Mills Sdn Bhd,5.253839,115.242717
P100000121208,Esteel Sabah Steel Plant,,Malaysia,announced,unknown,,,,,,5000,,5000,,0.0,Esteel Enterprise Sabah Sdn Bhd,6.104211,116.202218
P100000121208,Esteel Sabah Steel Plant,,Malaysia,construction,2026,,,,,,2500,,2500,,0.0,Esteel Enterprise Sabah Sdn Bhd,6.104211,116.202218
P100000120742,Hebei Xin Wu an Steel Malaysia plant,,Malaysia,announced,unknown,5000.0,5000.0,,,,5000,5000,,,10000.0,Hebei Xinwuan Iron and Steel Group Co Ltd,3.586453,113.359851
P100000120742,Hebei Xin Wu an Steel Malaysia plant,,Malaysia,construction,unknown,5000.0,5000.0,,,,5000,5000,,,10000.0,Hebei Xinwuan Iron and Steel Group Co Ltd,3.586453,113.359851
P100000120738,Lion Industries Amsteel Banting steel plant,,Malaysia,operating,2001,1250.0,,1250.0,,,,,,,2500.0,Amsteel Mills Sdn Bhd,2.806998,101.601053
P100000120738,Lion Industries Amsteel Banting steel plant,,Malaysia,mothballed,2001,,,,,,1540,,1540,,0.0,Amsteel Mills Sdn Bhd,2.806998,101.601053
P100000120739,Lion Industries Amsteel Klang steel plant,,Malaysia,operating,1982,750.0,,750.0,,,,,,,1500.0,Amsteel Mills Sdn Bhd,3.069682,101.456474
P100000120739,Lion Industries Amsteel Klang steel plant,,Malaysia,announced,unknown,1600.0,1600.0,,,,1600,1600,,,3200.0,Amsteel Mills Sdn Bhd,3.069682,101.456474
P100000120740,Lion Industries Megasteel plant,,Malaysia,mothballed,1930,3200.0,,3200.0,,,,,,,6400.0,Megasteel Sdn Bhd,2.8072653,101.6055808
P100001047854,Maegma Minerals Lumut HBI plant,,Malaysia,announced,2029,,,,,,2000,,2000,,0.0,Maegma Minerals,4.2405829,100.5949428
P100000120741,Maju Perwaja Steel plant,,Malaysia,mothballed,1984,1500.0,,1500.0,,,1200,,1200,,3000.0,Perwaja Steel Sdn Bhd,4.264364,103.461728
P100000120746,Malaysia Steel Works Klang,,Malaysia,operating,1998,800.0,,,,800,,,,,800.0,Malaysia Steel Works (KL) Bhd,3.077835,101.46448
P100000120746,Malaysia Steel Works Klang,,Malaysia,retired,1998,750.0,,750.0,,,,,,,1500.0,Malaysia Steel Works (KL) Bhd,3.077835,101.46448
P100000120745,Perfect Channel Gurun steel plant,,Malaysia,announced,unknown,1000.0,,500.0,,500,,,,,1500.0,Perfect Channel Sdn Bhd,5.778871,100.49907
P100000121055,Southern Steel Prai Penang plant,,Malaysia,operating,1963,1400.0,,1400.0,,,,,,,2800.0,Southern Steel Bhd,5.399453,100.382177
P100000120724,Altos Hornos De Mexico SA AHMSA steel plant,Siderúrgica Altos Hornos De Mexico S.A. (AHMSA),Mexico,mothballed,1944,5500.0,4300.0,1200.0,,,4380,4380,,,11000.0,Altos Hornos de Mexico SAB de CV,26.876889,-101.416612
P100000120725,ArcelorMittal Lázaro Cárdenas steel plant,Siderúrgica Lázaro Cárdenas,Mexico,operating,1976-11-04 00:00:00,6500.0,2500.0,4000.0,,,4652,1452,3200,,13000.0,ArcelorMittal México SA de CV,17.930688,-102.201498
P100000120726,DEACERO Celaya steel plant,Acería DEACERO Celaya,Mexico,operating,1998,2300.0,,2300.0,,,,,,,4600.0,DeAcero SAPI de CV,20.518556,-100.925556
P100000120726,DEACERO Celaya steel plant,Acería DEACERO Celaya,Mexico,construction,unknown,,,,,,,,,,0.0,DeAcero SAPI de CV,20.518556,-100.925556
P100000120730,DEACERO Ramos Arizpe steel plant,Acería DEACERO Ramos Arizpe,Mexico,operating,1986,2200.0,,2200.0,,,,,,,4400.0,DeAcero SAPI de CV,25.511162,-100.961848
P100000120730,DEACERO Ramos Arizpe steel plant,Acería DEACERO Ramos Arizpe,Mexico,announced,2026,1500.0,,1500.0,,,,,,,3000.0,DeAcero SAPI de CV,25.511162,-100.961848
P100000120727,Gerdau Corsa Ciudad Sahagún steel plant,Gerdau Corsa Planta Sahagún,Mexico,operating,2015,1000.0,,1000.0,,,,,,,2000.0,Gerdau Corsa SAPI de CV,19.753326,-98.596483
P100000120735,Gerdau Corsa Tultitlán steel plant,Gerdau Corsa Sidertul,Mexico,operating,1984,500.0,,500.0,,,,,,,1000.0,Gerdau Corsa SAPI de CV,19.630355,-99.180315
P100000120736,Grupo Acerero steel plant,Acería Grupo Acerero,Mexico,operating,2004,725.0,,725.0,,,,,,,1450.0,Grupo Acerero SA de CV,22.087328,-100.901902
P100000120736,Grupo Acerero steel plant,Acería Grupo Acerero,Mexico,construction,2025-09-01 00:00:00,650.0,,650.0,,,,,,,1300.0,Grupo Acerero SA de CV,22.087328,-100.901902
P100000120733,Grupo Simec Apizaco Cholula steel plant,Acería Simec Apizaco,Mexico,operating,2018-07-01 00:00:00,1140.0,,1140.0,,,,,,,2280.0,Aceros Especiales Simec Tlaxcala SA de CV,19.395628,-98.088777
P100000120737,Grupo Simec San Luis steel plants,Acería Simec San Luis,Mexico,operating,1993,816.0,,816.0,,,,,,,1632.0,Aceros Especiales Simec Tlaxcala SA de CV,22.103324,-100.919202
P100000120731,Tenaris TAMSA Veracruz steel plant,Centro Industrial Tenaris Tamsa,Mexico,operating,1954,1230.0,,1230.0,,,,,,,2460.0,Tubos de Acero de Mexico SA,19.182499,-96.237284
P100000120734,Ternium Apodaca steel plant,"Ternium Largos Norte, Acería Ternium Apodaca",Mexico,operating,1993,600.0,,600.0,,,,,,,1200.0,Ternium México SA de CV,25.742085,-100.236478
P100000120729,Ternium Guerrero San Nicolás de los Garza steel plant,Planta Ternium Guerrero,Mexico,operating,1943,2400.0,,2400.0,,,1730,,1730,,4800.0,Ternium México SA de CV,25.720327,-100.301175
P100000121053,Ternium Pesquería steel plant,Planta Ternium Pesquería,Mexico,construction,2026,2600.0,,2600.0,,,2100,,2100,,5200.0,Ternium México SA de CV,25.743837,-99.965278
P100000120728,Ternium Puebla steel plant,Planta Largos Ternium Puebla,Mexico,operating,1969,1330.0,,1330.0,,,930,,930,,2660.0,Ternium México SA de CV,19.169532,-98.318659
P100000120732,TYASA steel plant,Siderúrgica TYASA,Mexico,operating,1993,1650.0,,1650.0,,,,,,,3300.0,Talleres y Aceros SA de CV,18.869272,-97.047263
P100000120721,JSC Moldova Steel Works,ММЗ,Moldova,operating,1985,1000.0,,1000.0,,,,,,,2000.0,Moldova Steel Works JSC,47.783771,29.02835
P100000120719,ArcelorMittal Sonasid Casablanca steel plant,,Morocco,operating,2005,800.0,,800.0,,,,,,,1600.0,ArcelorMittal SA,33.136529,-8.603555
P100000120718,Mahgreb Steel Casablanca plant,المغربية للصلب,Morocco,operating,1975,1200.0,,1200.0,,,,,,,2400.0,Maghreb Steel SA,33.592793,-7.475613
P100000120720,Riva Industries Jorf Lasfar steel plant,ريفا للصناعات,Morocco,operating,2021,800.0,,800.0,,,,,,,1600.0,Riva Industries,33.165438,-8.5883
P100000121230,Univers Acier Sidi Hajjaj steel plant,العالمية للصلب,Morocco,operating,2002,1200.0,,1200.0,,,,,,,2400.0,Univers Acier,33.501325,-7.467363
P100000120752,Tete Steel Maputo plant,,Mozambique,construction,unknown,500.0,,500.0,,,1100,,1100,,1000.0,Baobab Steel Ltd,-15.724345,33.762664
P100000120723,Kunming Iron and Steel Myanmar plant,,Myanmar,announced,unknown,4000.0,4000.0,,,,4000,4000,,,8000.0,Kunming Iron & Steel Holding Co Ltd,21.423783,96.454378
P100001023431,Myanmar Economic Corporation Pin Pet No 2 Steel Mill,,Myanmar,mothballed,2016,,,,,,5000,,5000,,0.0,Myanmar Economic Corp,20.7821113,97.0378298
P100000121156,Myingyan Myanmar Steel Plant,,Myanmar,operating,unknown,200.0,,200.0,,,,,,,400.0,Myanmar Economic Corp,21.377652,95.372079
P100000121156,Myingyan Myanmar Steel Plant,,Myanmar,construction,unknown,200.0,,200.0,,,500,,500,,400.0,Myanmar Economic Corp,21.377652,95.372079
P100000120753,Abba Steel Ohangwena steel plant,,Namibia,construction,unknown,3000.0,,3000.0,,,,,,,6000.0,Abba Steel Ltd,-17.397866,15.891022
P100000120754,HyIron Steel Namibia plant,,Namibia,operating,2025,,,,,,1000,,1000,,0.0,Hyron Africa,-22.084183,17.4099154
P100000120754,HyIron Steel Namibia plant,,Namibia,construction,unknown,1500.0,,1500.0,,,,,,,3000.0,Hyron Africa,-22.084183,17.4099154
P100000120758,Tata Steel IJmuiden steel plant,,Netherlands,announced,2030,6000.0,,6000.0,,,5655,,5655,,12000.0,Tata Steel Ijmuiden BV,52.484118,4.615584
P100000120758,Tata Steel IJmuiden steel plant,,Netherlands,operating pre-retirement,1918,7500.0,7500.0,,,,6310,6310,,,15000.0,Tata Steel Ijmuiden BV,52.484118,4.615584
P100000120759,Van Merksteijn International steel plant,,Netherlands,announced,unknown,580.0,,580.0,,,,,,,1160.0,Van Merksteijn International BV,53.440581,6.844773
P100000120761,BlueScope New Zealand Steel Glenbrook,,New Zealand,operating,1969,,,,,,326,,326,,0.0,New Zealand Steel Ltd,-37.206878,174.728098
P100000120761,BlueScope New Zealand Steel Glenbrook,,New Zealand,construction,2026,650.0,,650.0,,,,,,,1300.0,New Zealand Steel Ltd,-37.206878,174.728098
P100000120761,BlueScope New Zealand Steel Glenbrook,,New Zealand,operating pre-retirement,1969,670.0,670.0,,,,326,,326,,1340.0,New Zealand Steel Ltd,-37.206878,174.728098
P100000120757,African Natural Resources and Mines Kaduna Steel Plant,,Nigeria,construction,unknown,1000.0,,,,1000,1000,,1000,,1000.0,African Natural Resources & Mines Ltd,9.462715,7.368
P100000120756,Ajaokuta Steel plant,,Nigeria,construction,unknown,1300.0,1300.0,,,,1355,1355,,,2600.0,Ajaokuta Steel Co Ltd,7.511336,6.689364
P100001045326,Kam Industries Kwara steel plant,,Nigeria,operating,1996,600.0,,600.0,,,,,,,1200.0,Kam Industries (Nigeria) Ltd,8.454565,4.5430531
P100001044951,Kogi Steel Project,,Nigeria,announced,unknown,1500.0,,,,1500,1500,,,1500,1500.0,Chart and Capstone Integrated Ltd,7.69346,6.806937
P100000120755,Premium Steel Warri plant,,Nigeria,mothballed,1982,1000.0,,1000.0,,,1020,,1020,,2000.0,Premium Steel and Mines Ltd,5.480763,5.769839
P100000121200,Vulcan Green Steel Nigeria plant,,Nigeria,announced,unknown,3000.0,,3000.0,,,,,,,6000.0,Vulcan Green Steel LLC,9.082,8.6753
P100000120690,Ch'ollima Steel Complex steel plant,천리마제강연합기업소,North Korea,operating,1956,752.0,,752.0,,,,,,,1504.0,Government of North Korea,38.926348,125.582628
P100000120690,Ch'ollima Steel Complex steel plant,천리마제강연합기업소,North Korea,construction,unknown,,,,,,,,,,0.0,Government of North Korea,38.926348,125.582628
P100000120687,Ch'ŏngjin Ironworks steel plant,청진제강소,North Korea,operating,1942,2000.0,1500.0,500.0,,,1699,1699,>0,,4000.0,Government of North Korea,41.777936,129.792399
P100000120688,Hwanghae Iron and Steel Complex steel plant,황해제철련합기업소,North Korea,operating,1914,1500.0,,750.0,750.0,,750,750,,,3000.0,Government of North Korea,38.742224,125.616814
P100000120691,Kim Chaek Iron and Steel Complex steel plant,김책제철연합기업소,North Korea,operating,1938,6000.0,3000.0,1500.0,1500.0,,2800,2800,,,12000.0,Government of North Korea,41.753784,129.752681
P100000121159,Tangshan Iron and Steel Kim Chaek Steel Plant,,North Korea,cancelled,unknown,1500.0,,,,1500,,,,,1500.0,Tanshan Iron and Steel,40.67524,129.201745
P100000120722,Makstil Skopje Steel plant,Rudnici i Železarnica Skopje,North Macedonia,operating,1967,550.0,,550.0,,,,,,,1100.0,Makstil AD,42.016228,21.46605
P100000120760,Sev.en GI Mo i Rana steel plant,,Norway,operating,1946,770.0,,770.0,,,,,,,1540.0,Sev.en Global Investments AS,66.311519,14.167557
P100000120766,Jindal Shadeed Iron & Steel Duqm plant,جندال شديد للحديد و الصلب,Oman,construction,2026,5000.0,,5000.0,,,4500,,4500,,10000.0,Jindal Shadeed Iron & Steel LLC,19.640299,57.677866
P100000120762,Jindal Steel Sohar plant,جندال شديد للحديد و الصلب,Oman,operating,2010,2400.0,,2400.0,,,1820,,1820,,4800.0,Jindal Shadeed Iron & Steel LLC,24.502551,56.600739
P100000120762,Jindal Steel Sohar plant,جندال شديد للحديد و الصلب,Oman,construction,2025,100.0,,100.0,,,,,,,200.0,Jindal Shadeed Iron & Steel LLC,24.502551,56.600739
P100000121038,Mitsui-Kobe Duqm DRI plant,,Oman,announced,2027,,,,,,5000,,5000,,0.0,Mitsui-Kobe Steel JV,19.529594,57.61573
P100000120763,Moon Iron & Steel Company Sohar plant,حديد القمر,Oman,operating,2020,1200.0,,1200.0,,,,,,,2400.0,Moon Iron and Steel Company SAOC,24.409437,56.520134
P100000120765,Sohar Steel plant,شركة صحار للحديد الصلب,Oman,operating,2008,700.0,,700.0,,,,,,,1400.0,Sohar Steel LLC,24.499869,56.599111
P100000120764,Sun Metals Sur steel plant,,Oman,cancelled,2014,2500.0,,2500.0,,,,,,,5000.0,Sun Metal Casting LLC,22.632992,59.416971
P100000120782,Agha Steel Industries Karachi plant,آغا اسٹیل انڈسٹریز لمیٹڈ (arabic),Pakistan,operating,2012-01-01 00:00:00,450.0,,450.0,,,,,,,900.0,Agha Steel Industries Ltd,24.841851,67.310159
P100000120782,Agha Steel Industries Karachi plant,آغا اسٹیل انڈسٹریز لمیٹڈ (arabic),Pakistan,announced,2025,,,,,,4500,4500,,,0.0,Agha Steel Industries Ltd,24.841851,67.310159
P100000121232,Amreli Steels Dhabeji plant,,Pakistan,operating,2011,600.0,,,,600,,,,,600.0,Amreli Steels Ltd,24.800326,67.504851
P100000121232,Amreli Steels Dhabeji plant,,Pakistan,announced,unknown,400.0,,,,400,,,,,400.0,Amreli Steels Ltd,24.800326,67.504851
P100000120784,Century Steel Khyber plant,,Pakistan,announced,2030,1000.0,,,,1000,>0,,,>0,1000.0,Century Steel Pte Ltd,34.124213,72.019181
P100000120784,Century Steel Khyber plant,,Pakistan,construction,unknown,500.0,,,,500,,,,,500.0,Century Steel Pte Ltd,34.124213,72.019181
P100001043026,Faizan Steel Karachi steel plant,,Pakistan,operating,2010,365.0,,,,365,,,,,365.0,Faizan Steel,24.897652,66.985678
P100001043026,Faizan Steel Karachi steel plant,,Pakistan,announced,unknown,183.0,,,,183,,,,,183.0,Faizan Steel,24.897652,66.985678
P100000120783,Ittehad Steel Faisalabad plant,,Pakistan,operating,2013,400.0,,,,400,,,,,400.0,Ittehad Steels Pvt Ltd,31.643426,73.198542
P100000120783,Ittehad Steel Faisalabad plant,,Pakistan,construction,unknown,600.0,,,,600,,,,,600.0,Ittehad Steels Pvt Ltd,31.643426,73.198542
P100000121231,Mughal Iron & Steel Industries Lahore plant,,Pakistan,operating,1999,583.0,,,,583,,,,,583.0,Mughal Iron & Steel Industries Ltd,31.653035,74.183149
P100000120780,National Steel Complex Limited Karachi Steel Plant,حديد الطويرقي,Pakistan,announced,unknown,1280.0,,1280.0,,,,,,,2560.0,National Steel Complex Ltd,24.789621,67.353238
P100000120780,National Steel Complex Limited Karachi Steel Plant,حديد الطويرقي,Pakistan,mothballed,2013-01-01 00:00:00,,,,,,1280,,1280,,0.0,National Steel Complex Ltd,24.789621,67.353238
P100000120781,Pakistan Steel Mills Karachi,پاکستان سٹیل ملز,Pakistan,retired,1981,3000.0,3000.0,,,,1230,1230,,,6000.0,Pakistan Steel Mills Corp Pvt Ltd,24.809977,67.35244
P100000120768,Aceros Arequipa Pisco steel plant,Planta siderúrgica de Pisco,Peru,operating,1987,1250.0,,1250.0,,,,,,,2500.0,Corporacion Aceros Arequipa SA,-13.788622,-76.168173
P100000120768,Aceros Arequipa Pisco steel plant,Planta siderúrgica de Pisco,Peru,mothballed,1987,850.0,,850.0,,,80,,80,,1700.0,Corporacion Aceros Arequipa SA,-13.788622,-76.168173
P100000120769,Gerdau Siderperu Chimbote steel plant,Planta siderúrgica Gerdau Siderperu Chimbote,Peru,operating,1958,750.0,,750.0,,,,,,,1500.0,Empresa Siderurgica del Peru SAA,-9.059693,-78.601178
P100000120769,Gerdau Siderperu Chimbote steel plant,Planta siderúrgica Gerdau Siderperu Chimbote,Peru,mothballed,1958,,,,,,500,400,100,,0.0,Empresa Siderurgica del Peru SAA,-9.059693,-78.601178
P100000120779,BaoSteel and SteelAsia Philippines plant,,Philippines,announced,unknown,3000.0,,3000.0,,,,,,,6000.0,SteelAsia Manufacturing Corp,12.585909,123.207423
P100000120776,HBIS and SteelAsia Lemery plant,,Philippines,announced,2025,4000.0,,4000.0,,,,,,,8000.0,SteelAsia Manufacturing Corp,13.916094,120.886414
P100000120778,Mount Zynai Integratred Steel Mill and Smelting Plant,,Philippines,construction,unknown,1500.0,,,,1500,1500,,,1500,1500.0,Mount Zynai 0304 Mining Corp,7.716994,122.998671
P100000120774,Panhua Group Mindanao steel plant,,Philippines,construction,2026,10000.0,10000.0,,,,10000,,,10000,20000.0,Panhua Group Co Ltd,8.526666,124.755711
P100000120775,Panhua Group Sarangani steel plant,,Philippines,construction,2025,2000.0,2000.0,,,,1790,1790,,,4000.0,Panhua Group Co Ltd,5.86655,125.078751
P100000120771,SteelAsia Batangas plant,,Philippines,construction,2025,600.0,,600.0,,,,,,,1200.0,SteelAsia Manufacturing Corp,13.972773,120.888788
P100000120772,SteelAsia Calaca plant,,Philippines,operating,1999,500.0,,500.0,,,,,,,1000.0,SteelAsia Manufacturing Corp,13.922346,120.823796
P100001054284,SteelAsia Candelaria steel Plant,,Philippines,announced,2027-07-01 00:00:00,1000.0,,1000.0,,,,,,,2000.0,SteelAsia Manufacturing Corp,13.907715594054,121.42949361105237
P100000120773,SteelAsia Compostela steel plant,,Philippines,operating,2023,1000.0,,1000.0,,,,,,,2000.0,SteelAsia Manufacturing Corp,10.45078,124.006424
P100000120770,SteelAsia Concepcion plant,,Philippines,construction,2027,1200.0,,1200.0,,,,,,,2400.0,SteelAsia Manufacturing Corp,15.325307,120.655361
P100000120785,ArcelorMittal Dąbrowa Górnicza steel plant,Oddział w Dąbrowie Górniczej,Poland,operating,1976,5001.0,5001.0,,,,4500,4500,,,10002.0,ArcelorMittal Poland SA,50.342417,19.285037
P100000120786,ArcelorMittal Kraków steel plant,Oddział w Krakowie,Poland,retired,1954,2600.0,2600.0,,,,1310,1310,,,5200.0,ArcelorMittal Poland SA,50.083849,20.096306
P100000120790,ArcelorMittal Warszawa steel plant,,Poland,operating,1957,750.0,,750.0,,,,,,,1500.0,Arcelormittal Warszawa SP zoo,52.291337,20.917302
P100000120788,Celsa Huta Ostrowiec steel plant,,Poland,operating,1813,900.0,,900.0,,,,,,,1800.0,Celsa Huta Ostrowiec SP zoo,50.947305,21.448763
P100000120787,CMC Zawiercie steel plant,,Poland,operating,1901,1700.0,,1700.0,,,,,,,3400.0,CMC Poland SP zoo,50.487463,19.456759
P100000120792,Ferrostal Labedy Gliwice steel plant,,Poland,operating,1993,500.0,,500.0,,,,,,,1000.0,Ferrostal Labedy SP zoo,50.357438,18.610739
P100000120789,Huta Czestochowa steel plant,Liberty Częstochowa,Poland,operating,1902,840.0,,840.0,,,,,,,1680.0,Liberty Steel Group,50.782614,19.165566
P100000120791,Weglokoks Ruda Slaska steel plant,"Huta Pokój (shared site, different facility)",Poland,cancelled,2027,1000.0,,1000.0,,,,,,,2000.0,Weglokoks Stal SP zoo,50.289858,18.874414
P100000120794,SN MAIA Siderurgia Nacional steel plant,,Portugal,operating,1974,600.0,,600.0,,,,,,,1200.0,SN MAIA Siderurgia Nacional SA,41.255085,-8.555285
P100000120793,SN SEIXAL Siderurgia Nacional steel plant,,Portugal,operating,1961,1100.0,,1100.0,,,,,,,2200.0,SN SEIXAL Siderurgia Nacional SA,38.616023,-9.068527
P100000120795,Industries Qatar Steel Mesaieed plant,قطر ستيل,Qatar,operating,1978,2574.0,,2574.0,,,1700,,1700,,5148.0,Qatar Steel Company QPSC,24.952688,51.584777
P100000120795,Industries Qatar Steel Mesaieed plant,قطر ستيل,Qatar,mothballed,1978,926.0,,926.0,,,800,,800,,1852.0,Qatar Steel Company QPSC,24.952688,51.584777
P100000120797,ArcelorMittal Hunedoara steel plant,,Romania,operating,1884,800.0,,800.0,,,,,,,1600.0,ArcelorMittal Hunedoara SA,45.735183,22.91627
P100000121240,Donalam Targoviste plant,,Romania,construction,2026,500.0,,500.0,,,,,,,1000.0,Donalam SRL,44.904569,25.458124
P100000121240,Donalam Targoviste plant,,Romania,mothballed,1973,300.0,,300.0,,,,,,,600.0,Donalam SRL,44.904569,25.458124
P100000120796,GFG Liberty Galati steel plant,,Romania,announced,2030,4100.0,,4100.0,,,2500,,2500,,8200.0,Liberty Galati SA,45.434119,27.976244
P100000120796,GFG Liberty Galati steel plant,,Romania,operating pre-retirement,1968,3000.0,3000.0,,,,2100,2100,,,6000.0,Liberty Galati SA,45.434119,27.976244
P100000120798,GLGH Resita steel plant,,Romania,operating,1771,500.0,,500.0,,,,,,,1000.0,GLGH Steel,45.293492,21.90241
P100000120799,Otelu Rosu Steel Plant,,Romania,mothballed,1796,850.0,,850.0,,,,,,,1700.0,Laminorul Danube Metallurgical Enterprise SRL,45.512949,22.339896
P100000121242,Tenaris Silcotub Calarasi steel mill,Silcotub Călărași,Romania,operating,2004,535.0,,535.0,,,,,,,1070.0,S.C. Silcotub SA,44.217275,27.29968
P100001045064,Ussuri Capital Romania steel plant,,Romania,announced,2027,1200.0,,1200.0,,,,,,,2400.0,Ussuri Capital,44.133338,28.64001
P100000120802,Abinsk Electric Steel Works,АЭМЗ,Russia,operating,2014,1550.0,,1550.0,,,,,,,3100.0,Abinski Elektrometallurgicheski Zavod LLC,44.881938,38.12751
P100000120803,Amurstal steel plant,ООО Амурметалл-Литьё,Russia,operating,1942,1150.0,,1150.0,,,,,,,2300.0,Amurstal LLC,50.563131,136.976362
P100000120803,Amurstal steel plant,ООО Амурметалл-Литьё,Russia,cancelled,1942,850.0,,850.0,,,,,,,1700.0,Amurstal LLC,50.563131,136.976362
P100000120803,Amurstal steel plant,ООО Амурметалл-Литьё,Russia,mothballed,1942,1000.0,,1000.0,,,,,,,2000.0,Amurstal LLC,50.563131,136.976362
P100000120825,Ashinskiy Metallurgical plant,ПАО «Ашинский метзавод»,Russia,operating,1900,1000.0,,1000.0,,,,,,,2000.0,Ashinskiy Metzavod PJSC,54.99484,57.277548
P100000120817,Balakovo Steel Plant,Металлургический завод Балаково,Russia,operating,2013,1250.0,,1250.0,,,,,,,2500.0,MZ Balakovo JSC,51.936009,47.81591
P100000120817,Balakovo Steel Plant,Металлургический завод Балаково,Russia,construction,2025,1500.0,,1500.0,,,,,,,3000.0,MZ Balakovo JSC,51.936009,47.81591
P100000120832,Donelektrostal Shakhty steel plant,"Металлургический комбинат ""Донэлектросталь""",Russia,construction,2025,730.0,,730.0,,,900,,900,,1460.0,Donelektrostal LLC,47.740352,40.18942
P100000120826,Ecolant steel plant,Металлургический завод Эколант,Russia,construction,2025,1800.0,,1800.0,,,2500,,2500,,3600.0,Ecolant LLC,55.323946,42.150702
P100000120811,Evraz NTMK steel plant,"НТМЗ (predecessor, Russian)",Russia,operating,1940,4400.0,4400.0,,,,5050,5050,,,8800.0,Evraz NTMK JSC,57.922851,60.033543
P100000120811,Evraz NTMK steel plant,"НТМЗ (predecessor, Russian)",Russia,mothballed,1940,,,,,,1800,1800,,,0.0,Evraz NTMK JSC,57.922851,60.033543
P100000120822,Evraz ZSMK steel plant,ЗСМК,Russia,operating,1932,8760.0,6560.0,2200.0,,,6200,6200,,,17520.0,Evraz ZSMK JSC,53.88618,87.257618
P100000120822,Evraz ZSMK steel plant,ЗСМК,Russia,announced,unknown,1141.0,1141.0,,,,,,,,2282.0,Evraz ZSMK JSC,53.88618,87.257618
P100000120822,Evraz ZSMK steel plant,ЗСМК,Russia,operating pre-retirement,1932,1141.0,1141.0,,,,,,,,2282.0,Evraz ZSMK JSC,53.88618,87.257618
P100000120806,IMH Tula steel plant,"Тула-Сталь (Russian, steel only)",Russia,operating,1935,2000.0,2000.0,,,,7746,7746,,,4000.0,Promsort LLC,54.156726,37.725551
P100000120830,Kamsky Metallurgical Works TEMPO,Камский металлургический комбинат ТЭМПО,Russia,operating,2016,504.0,,504.0,,,,,,,1008.0,KMK Tempo JSC,55.726872,52.535854
P100000120823,Lebedinsky GOK DRI Plant,Лебединский ГОК,Russia,operating,1971,,,,,,4600,,4600,,0.0,Lebedinskiy GOK JSC,51.261995,37.654622
P100000120823,Lebedinsky GOK DRI Plant,Лебединский ГОК,Russia,announced,2025,,,,,,1960,,1960,,0.0,Lebedinskiy GOK JSC,51.261995,37.654622
P100000120807,Magnitogorsk Iron and Steel Works,Магнитогорский металлургический комбинат,Russia,operating,1932,14500.0,10500.0,4000.0,,,7540,7540,,,29000.0,Magnitogorskiy Metallurgicheskiy Kombinat PJSC,53.427593,59.054122
P100000120807,Magnitogorsk Iron and Steel Works,Магнитогорский металлургический комбинат,Russia,announced,unknown,,,,,,3700,3700,,,0.0,Magnitogorskiy Metallurgicheskiy Kombinat PJSC,53.427593,59.054122
P100000120807,Magnitogorsk Iron and Steel Works,Магнитогорский металлургический комбинат,Russia,operating pre-retirement,1932,,,,,,3586,3586,,,0.0,Magnitogorskiy Metallurgicheskiy Kombinat PJSC,53.427593,59.054122
P100000120805,Mechel Chelyabinsk Metallurgical Plant,Челябинский металлургический комбинат,Russia,operating,1943,5799.0,3999.0,1800.0,,,4000,4000,,,11598.0,Chelyabinskiy Metallurgicheskiy Kombinat PJSC,55.27073,61.436492
P100000120828,Metalloinvest Mikhailovsky HBI plant,Михайловский ГБЖ,Russia,announced,unknown,,,,,,2080,,2080,,0.0,Mikhailovsky HBI LLC,52.360448,35.397314
