Plant ID,Plant name (English),Plant name (other language),Country/Area,Status,Start date,Nominal crude steel capacity (ttpa),Nominal BOF steel capacity (ttpa),Nominal EAF steel capacity (ttpa),Nominal OHF steel capacity (ttpa),Other/unspecified steel capacity (ttpa),Nominal iron capacity (ttpa),Nominal BF capacity (ttpa),Nominal DRI capacity (ttpa),Other/unspecified iron capacity (ttpa),Total Capacity (ttpa),Owner,Latitude,Longitude
P100000120004,Kurum International Elbasan steel plant,Kurum Kombinati metalurgjik,Albania,mothballed,1998,700.0,,700.0,,,,,,,1400.0,Kurum International ShA,41.094611,20.026117
P100000120439,Algerian Qatari Steel Jijel plant,الجزائرية القطرية للصلب,Algeria,operating,2017,2200.0,,2200.0,,,2500,,2500,,4400.0,Algerian Qatari Steel,36.753961,6.24442
P100000120439,Algerian Qatari Steel Jijel plant,الجزائرية القطرية للصلب,Algeria,announced,2026,1800.0,,1800.0,,,2500,,2500,,3600.0,Algerian Qatari Steel,36.753961,6.24442
P100000120442,ETRHB Annaba steel plant,,Algeria,cancelled,unknown,1150.0,,1150.0,,,,,,,2300.0,ETRHB Industrie SpA,36.834412,7.45494
P100000121198,Ozmert Algeria Steel Plant,,Algeria,operating,unknown,800.0,,800.0,,,500,,500,,1600.0,Ozmert Algeria SARL,,
P100000120440,Sider El Hadjar Annaba steel plant,مركب الحجار للحديد والصلب,Algeria,operating,1969,2150.0,350.0,1800.0,,,1500,1500,,,4300.0,Groupe Industriel Sider SpA,36.795924,7.707633
P100000120440,Sider El Hadjar Annaba steel plant,مركب الحجار للحديد والصلب,Algeria,cancelled,1969,,,,,,2500,,2500,,0.0,Groupe Industriel Sider SpA,36.795924,7.707633
P100000120441,Tosyali Algerie Oran steel plant,شركة توسيالي الجزائرية التركية للحديد والصلب,Algeria,operating,2013,6200.0,,6200.0,,,5000,,5000,,12400.0,Tosyali Ironsteel Industry Algerie SpA,35.770912,-0.263031
P100000120005,Aceria Angola Bengo steel plant,,Angola,operating,2015,500.0,,,,500,,,,,500.0,Ada - Aceria De Angola SA,-8.5824,13.405271
P100000121215,Companhia Siderurgica do Cuchi pig iron plant,,Angola,operating,2023-09-01 00:00:00,,,,,,96,96,,,0.0,Companhia Siderurgica do Cuchi SA,-14.650166,16.925606
P100000121215,Companhia Siderurgica do Cuchi pig iron plant,,Angola,announced,2025,,,,,,423,423,,,0.0,Companhia Siderurgica do Cuchi SA,-14.650166,16.925606
P100001042927,Tosyali Sonangol Kassinga Iron and Steel Plant,,Angola,announced,unknown,1000.0,,1000.0,,,1200,,1200,,2000.0,Sonangol EP; Tosyali Iron and Steel Angola SA,-15.263743,16.065494
P100000120006,ArcelorMittal Acindar Villa Constitución steel plant,Planta siderúrgica Acindar,Argentina,operating,1946,2000.0,,2000.0,,,600,,600,,4000.0,Acindar Industria Argentina de Aceros SA,-33.249936,-60.300415
P100000120009,Gerdau Sipar Pérez steel plant,Planta siderúrgica Gerdau Sipar Pérez,Argentina,operating,2017,650.0,,650.0,,,,,,,1300.0,Sipar Aceros SA,-32.9912336,-60.7588733
P100000120007,TenarisSiderca Campana steel plant,Planta siderúrgica TenarisSiderca,Argentina,operating,1960-07-25 00:00:00,1720.0,,1720.0,,,960,,960,,3440.0,Siderca SAIC,-34.152554,-58.977388
P100000120007,TenarisSiderca Campana steel plant,Planta siderúrgica TenarisSiderca,Argentina,retired,1960-07-25 00:00:00,530.0,,530.0,,,,,,,1060.0,Siderca SAIC,-34.152554,-58.977388
P100000120008,Ternium Siderar San Nicolás steel plant,"Ternium Planta Savio, Somisa (Sociedad Mixta Siderurgia Argentina) (predecessor)",Argentina,operating,1960,3501.0,3501.0,,,,4015,4015,,,7002.0,Ternium Argentina SA,-33.37365,-60.138697
P100000120012,BlueScope Port Kembla steel plant,,Australia,operating,1928,3200.0,3200.0,,,,,,,,6400.0,BlueScope Steel Ltd,-34.463834,150.886191
P100000120012,BlueScope Port Kembla steel plant,,Australia,mothballed,1928,,,,,,3000,3000,,,0.0,BlueScope Steel Ltd,-34.463834,150.886191
P100000120012,BlueScope Port Kembla steel plant,,Australia,operating pre-retirement,1928,,,,,,3000,3000,,,0.0,BlueScope Steel Ltd,-34.463834,150.886191
P100001043035,Fortescue Christmas Creek Green Metal Project,,Australia,construction,unknown,,,,,,1500,,,1500,0.0,Fortescue Ltd,-22.398723,119.725896
P100000120014,GFG Liberty Laverton Steel Mill,,Australia,operating,1992,780.0,,780.0,,,,,,,1560.0,Infrabuild Australia Pty Ltd,-37.831379,144.788169
P100000120013,GFG Liberty Steel Australia Whyalla steel plant,,Australia,announced,2027,1500.0,,1500.0,,,1800,,1800,,3000.0,GFG Alliance Ltd,-33.009381,137.587836
P100000120013,GFG Liberty Steel Australia Whyalla steel plant,,Australia,operating pre-retirement,1941,1200.0,1200.0,,,,1200,1200,,,2400.0,GFG Alliance Ltd,-33.009381,137.587836
P100000120015,GFG Liberty Sydney Steel Mill,,Australia,operating,1982,750.0,,750.0,,,,,,,1500.0,Infrabuild Australia Pty Ltd,-33.76601,150.849819
P100000121147,Green Steel of WA Collie Steel plant,,Australia,announced,2026,500.0,,500.0,,,,,,,1000.0,Green Steel of WA Pty Ltd,-33.341998,116.239926
P100000121163,Green Steel of WA Geraldton Steel plant,,Australia,announced,2028,,,,,,2500,,2500,,0.0,Green Steel of WA Pty Ltd,-28.766858,114.799967
P100001026026,GreenSteel Australia New South Wales Steel Plant,,Australia,announced,2026,5000.0,,5000.0,,,1200,,1200,,10000.0,H2gs AB,-34.4637185,150.8865407
P100000121161,POSCO Port Hedland Iron Project,,Australia,announced,2028,,,,,,12000,,12000,,0.0,Port Hedland Iron Pty Ltd,-20.395832,118.537975
P100000120011,Voestalpine Stahl Donawitz steel plant,,Austria,operating,1878,720.0,720.0,,,,826,825,1,,1440.0,Voestalpine Stahl Donawitz GmbH,47.380455,15.065182
P100000120011,Voestalpine Stahl Donawitz steel plant,,Austria,construction,2027,1700.0,,1700.0,,,,,,,3400.0,Voestalpine Stahl Donawitz GmbH,47.380455,15.065182
P100000120011,Voestalpine Stahl Donawitz steel plant,,Austria,operating pre-retirement,1878,850.0,850.0,,,,825,825,,,1700.0,Voestalpine Stahl Donawitz GmbH,47.380455,15.065182
P100000120010,Voestalpine Stahl Linz steel plant,,Austria,operating,1940,4000.0,4000.0,,,,3300,3300,,,8000.0,Voestalpine Stahl GmbH,48.274023,14.33434
P100000120010,Voestalpine Stahl Linz steel plant,,Austria,construction,2027,1600.0,,1600.0,,,,,,,3200.0,Voestalpine Stahl GmbH,48.274023,14.33434
P100000120010,Voestalpine Stahl Linz steel plant,,Austria,operating pre-retirement,1940,2000.0,2000.0,,,,1700,1700,,,4000.0,Voestalpine Stahl GmbH,48.274023,14.33434
P100000121043,Azerbaijan Integrated Steel Mill Complex,,Azerbaijan,cancelled,unknown,1250.0,,1250.0,,,1250,,1250,,2500.0,Azerbaijan Integrated Steel Mill Complex,40.721908,46.363526
P100000120016,Baku Steel Company steel plant,Бакинский сталелитейный завод,Azerbaijan,operating,2001,800.0,,800.0,,,,,,,1600.0,Baku Steel Company QSC,40.43136,49.886867
P100000120032,Sulb Bahrain Al Hidd steel plant,شركة صلب,Bahrain,operating,2012,1265.0,,1265.0,,,1619,,1619,,2530.0,Sulb Company BSCC,26.198152,50.679893
P100000120020,Abul Khair Steel Sitakunda plant,,Bangladesh,operating,2015,1400.0,,1400.0,,,,,,,2800.0,Abul Khair Steel Ltd,22.472008,91.734827
P100000120019,Bashundhara Steel Mirsarai plant,,Bangladesh,announced,2026,,,,,,2200,,2200,,0.0,Bashundhara Multi Steel Industries Ltd,22.719278,91.470382
P100000120019,Bashundhara Steel Mirsarai plant,,Bangladesh,construction,2026,1250.0,,1250.0,,,,,,,2500.0,Bashundhara Multi Steel Industries Ltd,22.719278,91.470382
P100000120022,BSRM Ltd Mirsarai plant,,Bangladesh,operating,2016-06-01 00:00:00,1625.0,,,,1625,,,,,1625.0,Bangladesh Steel Re-Rolling Mills Ltd,22.870631,91.545862
P100000120021,BSRM Steels Mirsarai plant,,Bangladesh,operating,2019,800.0,,,,800,,,,,800.0,BSRM Steels Ltd,22.873774,91.545562
P100000120018,GPH Steel Sitakunda plant,,Bangladesh,operating,2008-08-21 00:00:00,1051.0,,840.0,,211,,,,,1891.0,GPH Ispat Ltd,22.536569,91.700729
P100000120024,KSRM Sitakunda steel plant,,Bangladesh,operating,1984,800.0,,800.0,,,,,,,1600.0,KSRM Steel Plant Ltd,22.499834,91.715778
P100001042845,Megnha Re-rolling and Steel Mills steel plant,,Bangladesh,announced,unknown,1400.0,,1400.0,,,,,,,2800.0,Meghna Re-rolling and Steel Mills Ltd,23.585487,90.648875
P100000120025,Star Consortium steel plant,,Bangladesh,cancelled,2023,2000.0,2000.0,,,,2000,2000,,,4000.0,Star Infrastructure Development Corp,22.774191,91.574601
P100001042855,Unitex Steel Mills Feni steel plant,,Bangladesh,construction,2025,1000.0,,1000.0,,,,,,,2000.0,Unitex Steel Mills Ltd,22.945182,91.512387
P100000120056,Byelorussian Steel Works,БМЗ,Belarus,operating,1984,3000.0,,3000.0,,,,,,,6000.0,BMZ-Upravlyayushchaya Kompaniya Kholdinga BMK JSC,52.849321,29.988985
P100000120029,Aperam Stainless Belgium Châtelet steel plant,,Belgium,operating,1976,1000.0,,1000.0,,,,,,,2000.0,Aperam Stainless Belgium NV,50.414998,4.532443
P100000120028,Aperam Stainless Belgium Genk steel plant,,Belgium,operating,1970,1200.0,,1200.0,,,,,,,2400.0,Aperam Stainless Belgium NV,50.933973,5.511494
P100000120027,ArcelorMittal Gent steel plant,,Belgium,operating,1966,2500.0,2500.0,,,,2300,2300,,,5000.0,ArcelorMittal SA,51.169929,3.804462
P100000120027,ArcelorMittal Gent steel plant,,Belgium,announced,unknown,2500.0,,2500.0,,,2500,,2500,,5000.0,ArcelorMittal SA,51.169929,3.804462
P100000120027,ArcelorMittal Gent steel plant,,Belgium,operating pre-retirement,1966,2500.0,2500.0,,,,2700,2700,,,5000.0,ArcelorMittal SA,51.169929,3.804462
P100000120030,Thy Marcinelle Charleroi steel plant,,Belgium,operating,1989,800.0,,800.0,,,,,,,1600.0,Thy-Marcinelle SA,50.410335,4.429693
P100000121153,ESM Mutún steel plant,Complejo Siderúrgico del Mutún,Bolivia,operating,2025-03-01 00:00:00,200.0,,200.0,,,250,,250,,400.0,Empresa Siderúrgica del Mutún,-19.137325,-57.880605
P100000121153,ESM Mutún steel plant,Complejo Siderúrgico del Mutún,Bolivia,announced,2025-03-01 00:00:00,500.0,,500.0,,,,,,,1000.0,Empresa Siderúrgica del Mutún,-19.137325,-57.880605
P100000120017,Pavgord Zenica steel plant,,Bosnia and Herzegovina,operating,1892,1940.0,1140.0,800.0,,,1100,1100,,,3880.0,Pavgord doo,44.224446,17.899815
P100000120053,Aperam Timóteo steel plant,Usina siderúrgica Aperam Timoteo,Brazil,operating,1949,900.0,,900.0,,,701,701,,,1800.0,Aperam Inox America do Sul SA,-19.531272,-42.639979
P100000120050,ArcelorMittal Barra Mansa steel plant,Usina siderúrgica ArcelorMittal Barra Mansa,Brazil,operating,1937,800.0,,800.0,,,,,,,1600.0,ArcelorMittal Brasil SA,-22.525806,-44.191067
P100000120045,ArcelorMittal Juiz de Fora steel plant,Usina siderúrgica Mendes Júnior,Brazil,operating,1984,1100.0,,1100.0,,,360,360,,,2200.0,ArcelorMittal Brasil SA,-21.626963,-43.462361
P100000120045,ArcelorMittal Juiz de Fora steel plant,Usina siderúrgica Mendes Júnior,Brazil,cancelled,1984,200.0,,200.0,,,,,,,400.0,ArcelorMittal Brasil SA,-21.626963,-43.462361
P100000120035,ArcelorMittal Monlevade steel plant,"ArcelorMittal Aços Longos , Companhia Siderúrgica Belgo-Mineira (Portuguese, predecessor)",Brazil,operating,1937,1200.0,1200.0,,,,1040,1040,,,2400.0,ArcelorMittal Brasil SA,-19.832129,-43.130164
P100000120035,ArcelorMittal Monlevade steel plant,"ArcelorMittal Aços Longos , Companhia Siderúrgica Belgo-Mineira (Portuguese, predecessor)",Brazil,cancelled,1937,1000.0,,1000.0,,,1200,1200,,,2000.0,ArcelorMittal Brasil SA,-19.832129,-43.130164
P100000120040,ArcelorMittal Pecém steel plant,CSP - Companhia Siderúrgica do Pecém,Brazil,operating,2016,3000.0,3000.0,,,,3192,3192,,,6000.0,ArcelorMittal Brasil SA,-3.585917,-38.858932
P100000120041,ArcelorMittal Piracicaba steel plant,Usina siderúrgica ArcelorMittal Piracicaba,Brazil,operating,1955,1100.0,,1100.0,,,,,,,2200.0,ArcelorMittal Brasil SA,-22.698154,-47.657146
P100000120036,ArcelorMittal Resende steel plant,Usina siderúrgica ArcelorMittal Resende,Brazil,operating,2009,1000.0,,1000.0,,,,,,,2000.0,ArcelorMittal Brasil SA,-22.493597,-44.512628
P100000120034,ArcelorMittal Tubarão steel plant,Usina Siderúrgica de Tubarão,Brazil,operating,1983,7500.0,7500.0,,,,7280,7280,,,15000.0,ArcelorMittal Tubarão Comercial SA,-20.253447,-40.242298
P100000120046,AVB Açailândia steel plant,Usina siderúrgica AVB Açailândia,Brazil,operating,2015,600.0,600.0,,,,720,720,,,1200.0,Aco Verde do Brasil SA,-4.874373,-47.4073517
P100000120039,CSN Volta Redonda steel plant,Usina siderúrgica CSN Presidente Vargas,Brazil,operating,1946,6251.0,5751.0,500.0,,,5580,5580,,,12502.0,Companhia Siderúrgica Nacional SA,-22.512631,-44.11287
P100000120033,Gerdau Açominas Ouro Branco steel plant,Usina siderúrgica Gerdau Açominas,Brazil,operating,1986,4360.0,4360.0,,,,4348,4348,,,8720.0,Gerdau Acominas SA,-20.543507,-43.75295
P100000120042,Gerdau Cosigua Santa Cruz steel plant,Usina siderúrgica Gerdau Cosigua,Brazil,operating,1971,936.0,,936.0,,,,,,,1872.0,Gerdau Acos Longos SA,-22.90242,-43.749319
P100000120047,Gerdau Divinópolis steel plant,Usina siderúrgica Gerdau Divinópolis,Brazil,operating,1953,600.0,600.0,,,,430,430,,,1200.0,Gerdau Acos Longos SA,-20.153931,-44.878995
P100000120049,Gerdau Guaíra Araucária steel plant,Usina siderúrgica Gerdau Guaíra Araucária,Brazil,mothballed,1982,420.0,,420.0,,,,,,,840.0,Gerdau Acos Longos SA,-25.564041,-49.421729
P100000120049,Gerdau Guaíra Araucária steel plant,Usina siderúrgica Gerdau Guaíra Araucária,Brazil,retired,1982,120.0,,120.0,,,,,,,240.0,Gerdau Acos Longos SA,-25.564041,-49.421729
P100000120055,Gerdau Pindamonhangaba steel plant,Usina siderúrgica Gerdau Pindamonhangaba,Brazil,operating,1980,530.0,,530.0,,,,,,,1060.0,Gerdau SA,-22.89918,-45.347726
P100000120048,Gerdau São Paulo Araçariguama steel plant,Usina siderúrgica Gerdau São Paulo Araçariguama,Brazil,operating,2006,950.0,,950.0,,,,,,,1900.0,Gerdau Acos Longos SA,-23.43864,-47.08825
P100000120052,Simec Cariacica steel plant,Usina siderúrgica Simec Cariacica,Brazil,operating,1942,600.0,,600.0,,,,,,,1200.0,GV do Brasil Industria e Comercio de Aço Ltda,-20.34291,-40.360864
P100000120052,Simec Cariacica steel plant,Usina siderúrgica Simec Cariacica,Brazil,announced,2025,200.0,,200.0,,,,,,,400.0,GV do Brasil Industria e Comercio de Aço Ltda,-20.34291,-40.360864
P100000120051,Simec Pindamonhangaba steel plant,Usina siderúrgica Simec Pindamonhangaba,Brazil,operating,2015,500.0,,500.0,,,,,,,1000.0,GV do Brasil Industria e Comercio de Aço Ltda,-22.921912,-45.413234
P100000120051,Simec Pindamonhangaba steel plant,Usina siderúrgica Simec Pindamonhangaba,Brazil,construction,2025,500.0,,500.0,,,,,,,1000.0,GV do Brasil Industria e Comercio de Aço Ltda,-22.921912,-45.413234
P100000121176,Sinobras Marabá steel plant,Usina Siderúrgica Sinobras Marabá,Brazil,operating,2007,475.0,,475.0,,,175,175,,,950.0,Siderurgica Norte Brasil SA,-5.414287,-49.081305
P100000121176,Sinobras Marabá steel plant,Usina Siderúrgica Sinobras Marabá,Brazil,announced,2027-07-01 00:00:00,500.0,500.0,,,,,,,,1000.0,Siderurgica Norte Brasil SA,-5.414287,-49.081305
P100000120038,Ternium Brasil Santa Cruz steel plant,Usina siderúrgica Ternium,Brazil,operating,2010,5200.0,5200.0,,,,5300,5300,,,10400.0,Ternium Brasil Ltda,-22.912549,-43.741614
P100000120037,Usiminas Cubatão steel plant,Usina Usiminas Cubatão,Brazil,mothballed,1963,4500.0,4500.0,,,,4500,4500,,,9000.0,Usinas Siderurgicas de Minas Gerais SA,-23.863092,-46.376294
P100000120043,Usiminas Ipatinga steel plant,Usina siderúrgica Usiminas Ipatinga,Brazil,operating,1962,5000.0,5000.0,,,,3660,3660,,,10000.0,Usinas Siderurgicas de Minas Gerais SA,-19.491277,-42.544253
P100000120043,Usiminas Ipatinga steel plant,Usina siderúrgica Usiminas Ipatinga,Brazil,mothballed,1962,,,,,,660,660,,,0.0,Usinas Siderurgicas de Minas Gerais SA,-19.491277,-42.544253
P100000121175,Vale Tecnored Marabá iron plant,Usina Vale Tecnored Marabá,Brazil,construction,2025,,,,,,500,,,500,0.0,Vale SA,-5.408654,-49.103539
P100000120044,Vallourec Jeceaba steel plant,Usina siderúrgica de Jeceaba,Brazil,operating,2011,1000.0,,1000.0,,,350,350,,,2000.0,Vallourec Soluções Tubulares do Brasil SA,-20.582683,-43.971555
P100000120044,Vallourec Jeceaba steel plant,Usina siderúrgica de Jeceaba,Brazil,cancelled,2011,,,,,,500,500,,,0.0,Vallourec Soluções Tubulares do Brasil SA,-20.582683,-43.971555
P100000120054,Viena Açailândia iron works,Usina siderúrgica Viena Açailândia,Brazil,operating,1988,,,,,,500,500,,,0.0,Andrade Valladares Engenharia e Construcao Ltda,-4.887877,-47.392157
P100000120031,Stomana Industry Pernik steel plant,,Bulgaria,operating,1958,1400.0,,1400.0,,,,,,,2800.0,Stomana Industry AD,42.595629,23.093095
P100000121154,Cambodia Iron and Steel Preah Vihear Plant,,Cambodia,cancelled,unknown,1000.0,1000.0,,,,3000,3000,,,2000.0,Cambodia Iron & Steel Mining Industry Group Co Ltd,13.366642,105.118129
P100000120686,China Baowu Phnom Penh steel plant,,Cambodia,announced,unknown,3100.0,3100.0,,,,3100,3100,,,6200.0,Xinjiang Bayi Steel Southern Xinjiang Steel Baicheng Co Ltd,11.56703,104.863893
P100000120059,Algoma steel plant,,Canada,operating,1901,3700.0,,3700.0,,,,,,,7400.0,Algoma Steel Group Inc,46.518984,-84.374068
P100000120059,Algoma steel plant,,Canada,mothballed,1901,,,,,,1000,1000,,,0.0,Algoma Steel Group Inc,46.518984,-84.374068
P100000120059,Algoma steel plant,,Canada,operating pre-retirement,1901,3200.0,3200.0,,,,2690,2690,,,6400.0,Algoma Steel Group Inc,46.518984,-84.374068
P100000120058,ArcelorMittal Dofasco steel plant,,Canada,operating,1912,1350.0,,1350.0,,,,,,,2700.0,ArcelorMittal Dofasco GP,43.269255,-79.804858
P100000120058,ArcelorMittal Dofasco steel plant,,Canada,announced,2028,2400.0,,2400.0,,,2500,,2500,,4800.0,ArcelorMittal Dofasco GP,43.269255,-79.804858
P100000120058,ArcelorMittal Dofasco steel plant,,Canada,mothballed,1912,,,,,,716,716,,,0.0,ArcelorMittal Dofasco GP,43.269255,-79.804858
P100000120058,ArcelorMittal Dofasco steel plant,,Canada,operating pre-retirement,1912,2700.0,2700.0,,,,2308,2308,,,5400.0,ArcelorMittal Dofasco GP,43.269255,-79.804858
P100000120057,ArcelorMittal Montreal steel plant,,Canada,operating,1914,2400.0,,2400.0,,,1650,,1650,,4800.0,ArcelorMittal Long Products Canada GP,45.835148,-73.254957
P100000120061,Cleveland-Cliffs Lake Erie steel plant,,Canada,operating,1980,2500.0,2500.0,,,,2400,2400,,,5000.0,Cleveland-Cliffs Inc,42.805448,-80.095313
P100000120060,Evraz Regina Steel plant,,Canada,operating,1961,1200.0,,1200.0,,,,,,,2400.0,Evraz North America PLC,50.51499,-104.630589
P100000120062,Gerdau Whitby Steel Mill,,Canada,operating,1964,1100.0,,1100.0,,,,,,,2200.0,Gerdau Ameristeel Corp,43.856461,-78.908997
P100000120063,Ivaco Rolling Mills steel plant,,Canada,operating,1971,650.0,,650.0,,,,,,,1300.0,Ivaco Rolling Mills 2004 LP,45.613941,-74.704608
P100000120064,Rio Tinto Fer et Titane steel plant,,Canada,operating,1950,600.0,600.0,,,,,,,,1200.0,Rio Tinto Iron and Titanium Canada Inc,46.044367,-73.138474
P100000120067,AZA Colina steel plant,Planta siderúrgica AZA Colina,Chile,operating,1999-06-15 00:00:00,520.0,,520.0,,,,,,,1040.0,Aceros AZA SA,-33.294729,-70.727881
P100000120066,CAP Acero Huachipato steel plant,Planta siderúrgica Huachipato,Chile,mothballed,1950,1450.0,1450.0,,,,1482,1482,,,2900.0,Compania Siderurgica Huachipato SA,-36.746421,-73.129171
P100000120163,Angang Group Xinyang Iron and Steel Co Ltd,安钢集团信阳钢铁有限责任公司,China,operating,1971,3600.0,3600.0,,,,1850,1850,,,7200.0,"Xinyang Iron & Steel Co.,ltd of Angang Group",32.488704,114.038243
P100000120163,Angang Group Xinyang Iron and Steel Co Ltd,安钢集团信阳钢铁有限责任公司,China,construction,unknown,,,,,,1138,1138,,,0.0,"Xinyang Iron & Steel Co.,ltd of Angang Group",32.488704,114.038243
P100000120163,Angang Group Xinyang Iron and Steel Co Ltd,安钢集团信阳钢铁有限责任公司,China,retired,1971,,,,,,1400,1400,,,0.0,"Xinyang Iron & Steel Co.,ltd of Angang Group",32.488704,114.038243
P100000120163,Angang Group Xinyang Iron and Steel Co Ltd,安钢集团信阳钢铁有限责任公司,China,operating pre-retirement,1971,,,,,,1400,1400,,,0.0,"Xinyang Iron & Steel Co.,ltd of Angang Group",32.488704,114.038243
P100000120089,Angang Lianzhong Stainless Steel Co Ltd,联众(广州)不锈钢有限公司,China,operating,2001,1900.0,,1900.0,,,,,,,3800.0,Angang Lianzhong Stainless Steel Corp,23.126822,113.505817
P100000120219,Angang Steel Co Ltd,鞍钢股份有限公司,China,operating,1998-09-14 00:00:00,20650.0,20650.0,,,,16610,16610,,,41300.0,Angang Steel Co Ltd,41.148267,122.983054
P100000120219,Angang Steel Co Ltd,鞍钢股份有限公司,China,retired,1998-09-14 00:00:00,3450.0,3450.0,,,,,,,,6900.0,Angang Steel Co Ltd,41.148267,122.983054
P100000120220,Angang Steel Co Ltd Bayuquan branch,鞍钢股份有限公司鲅鱼圈钢铁分公司,China,operating,2006,7500.0,7500.0,,,,6400,6400,,,15000.0,Angang Steel Co Ltd,40.308494,122.13079
P100000120070,Anhui Changjiang Steel Co Ltd,安徽长江钢铁股份有限公司,China,operating,2003,3800.0,2700.0,1100.0,,,3340,3340,,,7600.0,Anhui Changjiang Steel Co Ltd,31.502272,118.465162
P100000120071,Anhui Guihang Special Steel Co Ltd,安徽省贵航特钢有限公司,China,operating,2010-04-01 00:00:00,2700.0,2700.0,,,,2080,2080,,,5400.0,Anhui Guihang Special Steel Co Ltd,30.531068,117.251147
P100000120391,Anhui Jin an Stainless Steel Casting Co Ltd,安徽金安不锈钢铸造有限公司,China,operating,2022,500.0,,500.0,,,,,,,1000.0,Anhui Jin'an Stainless Steel Foundry Co Ltd,31.763956,115.924372
P100000120417,Anhui Jingxian Longxin Iron and Steel Co Ltd,安徽省泾县隆鑫钢铁有限公司,China,construction,unknown,500.0,,500.0,,,,,,,1000.0,Anhui Jingxian Longxin Iron and Steel Co Ltd,30.709058,118.436638
P100000120417,Anhui Jingxian Longxin Iron and Steel Co Ltd,安徽省泾县隆鑫钢铁有限公司,China,operating pre-retirement,2008,500.0,,500.0,,,,,,,1000.0,Anhui Jingxian Longxin Iron and Steel Co Ltd,30.709058,118.436638
P100000120402,Anhui Langxi Hongtai Iron and Steel Co Ltd,安徽省郎溪县鸿泰钢铁有限公司,China,operating,2002,1000.0,,1000.0,,,,,,,2000.0,Anhui Langxi County Fuhang Steel Co Ltd,31.246635,119.120443
P100000120402,Anhui Langxi Hongtai Iron and Steel Co Ltd,安徽省郎溪县鸿泰钢铁有限公司,China,retired,2002,1100.0,,1100.0,,,,,,,2200.0,Anhui Langxi County Fuhang Steel Co Ltd,31.246635,119.120443
P100001025923,Anhui Lixin Special Steel Co Ltd,安徽省力鑫特钢有限公司,China,operating,2011-11-25 00:00:00,500.0,,500.0,,,,,,,1000.0,"Guangde Xinyuanda Metal Products Co., Ltd. Co Ltd",31.0494162,119.5296269
P100000120313,Anhui Shoukuang Dachang Metal Material Co Ltd,安徽首矿大昌金属材料有限公司,China,operating,2010,3000.0,3000.0,,,,7442,7442,,,6000.0,Anhui Shoukuang Dachang Metal Material Co Ltd,32.329171,115.954963
P100000120231,Anshan Baode Iron and Steel Co Ltd,鞍山宝得钢铁有限公司,China,operating,1999-05-28 00:00:00,1800.0,1800.0,,,,1150,1150,,,3600.0,Anshan Baode Iron & Steel Co Ltd,41.173613,122.945501
P100000120221,Ansteel Group Chaoyang Steel and Iron Co Ltd,鞍钢集团朝阳鞍凌钢铁有限公司,China,operating,2007-07-19 00:00:00,2100.0,2100.0,,,,2600,2600,,,4200.0,Angang Steel Co Ltd,41.528945,120.369983
P100000120170,Anyang Huixin Special Steel Co Ltd,安阳汇鑫特钢有限公司,China,operating pre-retirement,2004,1200.0,1200.0,,,,850,850,,,2400.0,Anyang Huixin Special Steel Co Ltd,36.152418,114.15839
P100000120160,Anyang Iron and Steel Co Ltd,安阳钢铁股份有限公司,China,operating,1958,5950.0,5950.0,,,,7969,7969,,,11900.0,Anyang Iron & Steel Co Ltd,36.122129,114.283145
P100000120160,Anyang Iron and Steel Co Ltd,安阳钢铁股份有限公司,China,retired,1958,1800.0,1800.0,,,,1852,1852,,,3600.0,Anyang Iron & Steel Co Ltd,36.122129,114.283145
P100000120160,Anyang Iron and Steel Co Ltd,安阳钢铁股份有限公司,China,operating pre-retirement,1958,1300.0,,1300.0,,,,,,,2600.0,Anyang Iron & Steel Co Ltd,36.122129,114.283145
P100000120166,Anyang Xinpu Steel Co Ltd,安阳市新普钢铁有限公司,China,operating pre-retirement,2005,2000.0,2000.0,,,,1400,1400,,,4000.0,Anyang Xinpu Steel Co Ltd,36.163203,114.296223
P100000120384,Baicheng Fuda Bar Rolling Co Ltd,白城市富达棒材轧制有限公司,China,construction,unknown,788.0,,788.0,,,,,,,1576.0,Baicheng Fuda Bar Rolling Co Ltd,45.593303,122.895588
P100000120384,Baicheng Fuda Bar Rolling Co Ltd,白城市富达棒材轧制有限公司,China,retired,2009-10-27 00:00:00,800.0,,800.0,,,,,,,1600.0,Baicheng Fuda Bar Rolling Co Ltd,45.593303,122.895588
P100000120256,Baoshan Iron and Steel Co Ltd Headquarters,宝山钢铁股份有限公司(宝山基地),China,operating,1977,19800.0,16200.0,3600.0,,,15300,15300,,,39600.0,Baoshan Iron & Steel Co Ltd,31.41623,121.440087
P100000120336,Baosteel Desheng Stainless Steel Co Ltd,宝钢德盛不锈钢有限公司,China,operating,2011,3220.0,3220.0,,,,4761,4761,,,6440.0,Baosteel Desheng Stainless Steel Co Ltd,26.48747,119.654461
P100000120336,Baosteel Desheng Stainless Steel Co Ltd,宝钢德盛不锈钢有限公司,China,retired,2011,3410.0,3410.0,,,,,,,,6820.0,Baosteel Desheng Stainless Steel Co Ltd,26.48747,119.654461
P100000120289,Baosteel Group Xinjiang Bayi Iron and Steel Co Ltd,"新疆八一钢铁集团有限责任公司, 宝钢集团新疆八一钢铁有限责任公司",China,operating,1995-10-20 00:00:00,7300.0,6850.0,450.0,,,5763,5763,,,14600.0,Baosteel Group Xinjiang Bayi Iron & Steel Co Ltd,43.852147,87.304639
P100000120289,Baosteel Group Xinjiang Bayi Iron and Steel Co Ltd,"新疆八一钢铁集团有限责任公司, 宝钢集团新疆八一钢铁有限责任公司",China,mothballed,1995-10-20 00:00:00,,,,,,400,400,,,0.0,Baosteel Group Xinjiang Bayi Iron & Steel Co Ltd,43.852147,87.304639
P100000120289,Baosteel Group Xinjiang Bayi Iron and Steel Co Ltd,"新疆八一钢铁集团有限责任公司, 宝钢集团新疆八一钢铁有限责任公司",China,retired,1995-10-20 00:00:00,,,,,,400,400,,,0.0,Baosteel Group Xinjiang Bayi Iron & Steel Co Ltd,43.852147,87.304639
